pub_id,pr_info
1622,"Эта база данных находится в Чикаго, штат Иллинойс, в Чикаго, штат Иллинойс. В Чикаго, издательство, издательство, издательство, издательство, издательство, издательство, издательство, издательство, издательство, издательство и т.д., находится в Чикаго, штат Иллинойс."
9952,"Это выборочные текстовые данные для Scootney Books, издателя 9952 в базе данных паба. Scootney Books находится в Нью-Йорке, Нью-Йорк."
9999,"Это образцы текстовых данных для Luberne Pubs Pubing, издателя 9999 в базе данных пабов. Luberne Pubs Pubs Pubs Pubs. Lucerne Publishing находится в Париже, Франция. Lucerne Publishing — это образцы текстовых данных для Lucerne Pubs Pubs. Lucerne Pubs Pubs Pubs. Lucerne Publishing — это образцы текстовых данных для Lucerne Publishing, издателя 9999 в базе данных пабов. Lucerne Pubs — в Париже, Франция."
736,"В базе данных о Новой Луне, в базе данных о Новой Луне, в базе данных New Moon Books, New Moon Books. В базе данных о Новой Луне, в базе данных о Новой Луне, в базе данных о Новой Луне, в базе данных о Новой Луне. В базе данных о Луне в Бостоне, Массачусетсе, в базе данных о Новой Луне, содержится образец текстовых данных для Новой Лунной Книги, в базе данных о Новой Луне, в базе данных о Новой Луне, в Новой Луне, в базе данных о Луне в Бостоне, Массачусетсе. В базе данных о Новой Луне, в базе данных о Новой Луне, в базе данных о Новой Луне, в базе данных о Новой Луне, в базе данных о Новой Луне. В базе данных о Новой Луне, в базе данных о Новой Луне, в Центральных учреждениях, в базе данных о Новой Луне, в Нью-Йорке, в базе данных о Новой Луне, в Нью-Йорке, в базе данных о Новой Луне."
1389,"Это данные для базы данных Algodata Infosystems, издателя 1389 в базе данных пабов. Algodata Infosystems находится в Беркли, штат Калифорния. Algodata Infosystems расположена в Беркли, штат Калифорния. Algodata Infosys в базе данных о пабах. Algodata Infosystems расположена в Беркли, штат Калифорния. Это выборочные текстовые данные для Algodata Infosystems в базе данных паба. Algodata Infosystems находится в Беркли, штат Калифорния. Это образцы текстовых данных для Algodata Infosystems, издателей Algodata Infosystems, издателей издательницы Algodats в Беркли, Калифорния."
877,"Это образцы текстовых данных для Binnet & Hardley, издателя 0877 в базе данных пабов. Binnet & Hardley находится в Вашингтоне, округ Колумбия. Это образцы текстовых данных для Binnet & Hardley, издателя 0877 в базе данных пабов. Binnet & Hardley находится в Вашингтоне, О.К. Это образцы текстовых данных для Binnet & Hardley, издателя 0877 в базе данных пабов. Binnet & Hardley находится в Вашингтоне, округ Колумбия. Это образцы текстовых данных для Binnet & Hardley в базе данных Binnet & Hardley. Binnet & Hardley находится в Вашингтоне, округ Колумбия."
9901,"Это выборочные текстовые данные для GGG&G, издателя 9901 в базе данных паба. GG&G находится в Мюнхене, Германия."
1756,"Это образцы текстовых данных для Ramona Publishers, издателя 1756 года в базе данных паба. Ramona Publishers расположена в Далласе, штат Техас."
