film_id,title,description
6,АГЕНТ ТРУМАН,"Вспыльчивая панорама робота и мальчика, который должен сбежать из сумо-рестлера в Древнем Китае"
8,ЗАГРЯЗНЯЮЩАЯ ВЕЩЕСТВА,"Эпическая история о музе и девушке, которая должна встретить обезьяну в древней Индии"
21,АМЕРИКАНСКИЙ ЦЕРКУС,"Разумная драма девушки и астронавта, которая должна встретиться с администратором базы данных в акульем танке"
27,ЧЕЛОВЕЧЕСКОЕ ЧЕЛОВЕЧЕСТВО,"Удивительное отражение администратора базы данных и астронавта, который должен выпустить администратора базы данных в акульем танке"
38,АРК-МОДЕЛИРОВАНИЕ,"Прекрасная ярна пионера и обезьяны, которые должны преследовать исследователь в пустыне Сахара"
52,БАЛЛОРНЫЙ МОКИНГ БОЛЛОРДА,"Ужасный документальный фильм композитора и обезьяны, которые должны найти феминистку в Калифорнии"
70,БИКИНИСКИЕ БОРРОУРЫ,"Поразительная драма астронавта и кошки, которая должна открыть женщину на первой пилотируемой космической станции"
94,ЧЕЛОВЕЧЕСКОЕ СОСТОЯНИЕ,"Рассказ о собаке и пасторе, который должен сражаться с девушкой в Берлине"
99,ГИСТЕРИЧЕСКИЕ ДВИЖЕНИЯ,"Ужасная сага акулы и технический писатель, который должен найти женщину в лодке"
108,Щелчок.,"Недостаток ярны феминистки и администратора базы данных, который должен встретиться с охотником в Новом Орлеане"
116,КАНДИДАТНЫЙ ПЕРИОД,"Блестящий пример композитора и администратора базы данных, который должен победить безумного учёного на первой пилотируемой космической станции"
123,СУПЕР КАСАБЛАНКИ,"Удивительная панорама крокодила и судебно-психиатра, который должен преследовать секретного агента на первой пилотируемой космической станции"
146,ЦЫПЛЕНОК,"Скучное зрелище лодки и администратор базы данных, который должен убить сумо-рестлера на первой пилотируемой космической станции"
150,СЛЕДУЮЩАЯ СЛЕДУЮЩАЯ СЕССИЯ,"Потрясающий характер исследования композитора и безумной коровы, который должен усыпить кота в Советской Грузии"
164,КРАЙНЯЯ РЫНКА,"Поразительный документальный фильм о безумной коре и пионере, который должен бросить вызов дворецкому в пустыне Сахара"
190,КЕЙПЕРЫ КАНЕ,"Тревожное воспоминание о белке и лодке, которая должна выгнать машину в джетовом лодке"
194,ГРЕЙСКИЙ ХАРАКТЕР,"Внушающий благоговение документальный фильм о женщине и муже, который должен поймать администратора базы данных на первой пилотируемой космической станции"
243,ПРЕЗИДЕНТ ДВЕРЕЙ,"Тревожное представление белки и женщины, которая должна превзойти мальчика в Мексиканском заливе"
258,ДИНАМИТ НАД НАРКОТИЧЕСКИМИ СРЕДСТВАМИ,"Эпическая показка крокодила и крокодила, который должен встретить собаку в заброшенном парке развлечений"
270,ЗЕМЛЕПОЛЬЗОВАНИЕ НА ЗЕМЛЕПОЛЬЗОВАНИЕ,"Потрясающая драма дворецкого и безумного человека, который должен выгнать женщину в древней Индии"
282,КОНСУЛЬТАТИВНЫЕ МЕРОПРИЯТИЯ,"Знаменитый волшебник и жених, который должен построить лодку в Новом Орлеане"
293,ИСПОРСКИЙ СТОЛ,"Прикасающаяся драма собаки и сумо-рестлер, который должен победить безумного учёного в Берлине"
298,Айс драйвинг,"Ужасная история о кошке и официантке, которая должна сражаться с исследовательницей в отставке"
302,Парк Фантазии,"Разумный документальный фильм о безумном учёном и акуле, который должен выгнать феминистку в Австралии"
313,ОБЕСПЕЧЕНИЕ ФИНАНСИРОВАНИЯ,"Внушающая благоговение драма технического писателя и композитора, который должен дотянуться до повара-пастуша в U-Boat"
377,ДЕТСКАЯ МОЛОДЕЖИ,"Эмоциональная панорама секретного агента и официантки, которая должна сбежать от композитора в Советской Грузии"
413,ХЕДВИГ АЛЬТЕР,"Упакованная в действие Ярна Женщина и Ламберджек, который должен вести сумо-рестлер в монастыре"
427,ХОЗЯЙСТВЕННЫЙ КАЙДЕР,"Дыхание астронавта и белки, которые должны бороться с белкой в Манхэттенском пентхаусе"
467,УЧАСТНИКИ,"Фантастическое исследование исследовательницы и безумного учёного, который должен изнасиловать белку в лодке-реактивнике"
486,JET NIGMODORS,"Удивительное представление о мухоловке и учителе, который должен выгнать женщину в U-Boat"
535,ЛЮБОВЫЕ УЧРЕЖДЕНИЯ,"Блестящая панорама охотника и исследователя, который должен преследовать дантиста в заброшенном доме веселья"
542,МУЗЫКА,"Фантастическая панорама охотника и дантиста, который должен встретиться с секретным агентом в пустыне Сахара"
549,МАГНОЛИЧЕСКАЯ ФОРЕСТРА,"Разумный документальный фильм композитора и Исследователя, который должен победить дантиста в Новом Орлеане"
556,"Надеюсь, МАЛТЕСЕ","Быстро распечатанный документальный фильм о крокодиле и сумо-рестлере, который должен завоевать исследователь в Калифорнии"
566,МОД,"Прекрасный документальный фильм судебно-психиатра и кошки, которая должна дотянуться до астронавта в Нигерии"
581,Поцелуи МЕНЬШИНСТВ,"Знаменитый показ мухоловки и сумо-рестлера, который должен встретить человека в отставке"
597,МОНВАЛКЕР ФУЛ,"Эпическая драма феминистки и пионера, который должен поглотить композитора в Новом Орлеане"
610,Музыка,"Потрясающая история о дворецком и астронавте, который должен сражаться с исследовательницей на первой пилотируемой космической станции"
611,МУЗЫКИ ЖДУТСЯ,"Прикасающийся ярн студента и мус, который должен сражаться с безумной коровой в Австралии"
612,ПРЕПЯТСТВИЯ МУССОЛИНИ,"Ужасное представление лодки и обезьяны, которые должны встретиться с композитором в Древнем Китае"
671,ПЕРСПЕКТИВНЫЙ ПЕРИОД,"Быстрая история о машине и кошке, которая должна перестрелять охотника в Берлине"
682,ПИТТШУРСКИЙ ГУМАНОК,"Ужасный порыв мальчика и лодки, который должен найти студента в Советской Грузии"
685,ПЛАТОНОВЫЙ ИНСТИТУТ,"Ужасная панорама мужчины и женщины, которая должна дотянуться до женщины в Австралии"
702,БОЛЕЕ ПОЛУЧАЙ,"Неверное представление о собаке и крокодиле, который должен вывести человека из Нигерии"
735,Роббиры Джон,"Разумная история о безумном учёном и официантке, которая должна встретить судебно-психиатра в Советской Грузии"
736,РОББЕРИЯ,"Взгляд на робота и белка, которые должны сражаться с лодкой в Древней Японии"
737,Рок Инстинкт,"Поразительное исследование робота и музея, которые должны преодолеть астронавта в древней Индии"
747,РОКСАННА РЕБЕЛЬ,"Потрясающая история пирожного шеф-повара и администратора базы данных, который должен бороться с человеком в отчаянии"
749,"ПРАВИЛА, КАСАЮЩИЕСЯ ЛЮДСКИХ","Прекрасный пример астронавта и студента, который должен встретить обезьяну в заброшенном доме веселья"
760,САМУРАЙСКИЙ ЛИОН,"Быстрая история пионера и астронавта, который должен дотянуться до лодки в Балуне"
773,СИДЕНЬЯ,"Знающий сага человека и судебно-психиатра, который должен открыть безумную корову в Конвенции MySQL"
791,ВОССТАВАЙСЯ ГОСПОДСТВОМ,"Фантастическая сага студентки и девушки, которая должна найти дворецкого в Древней Японии"
802,ЧЕРЕЗ МИРОЧКА,"Эпическая драма безумного учёного и исследователя, который должен убрать официантку в заброшенном доме веселья"
803,ЛЮБОВЫЕ СЛУЧАИ СЛУЧАИ,"Быстрый рассказ об акуле и студенте, который должен встретиться с крокодилом в Древнем Китае"
812,ДВИГАЮЩАЯСЯ БАРБАРЕЛЬЯ,"Недостаток сага безумной коровы и безумного учёного, который должен поглотить кошку в Конвенции MySQL"
817,ЭВОЛЮЦИЯ СОЛДЕЙСТВИЙ,"Панорама акулы и пионера, который должен встретить студента на первой пилотируемой космической станции"
846,ПЕРСОНАЛЬНАЯ ПЕРСОНАЛА,"Фантастическая драма фрисби и собаки, которые должны сражаться с безумцем в лодке"
847,СТОКНЫЙ ГЛАСС,"Скучное зрелище крокодила и люмберджека, который должен перестрелять мус в Древнем Китае"
885,TEXAS НАСТОЯЩЕЕ,"Учительница и учительница, которые должны сражаться с учителем в заброшенном парке развлечений"
891,ТИМБЕРЛАНДНЫЙ ШКИЙ,"Скучное представление о человеке и собаке, который должен вернуть девушку в U-Boat"
926,ТАМОЖЕННАЯ ТАМОЖЕННАЯ СТРУКТУРА,"Удивительный документальный фильм о женщине и астронавте, который должен выгнать учителя в заброшенном доме веселья"
943,ВЕРХНЯЯ ДЕСПЕРАТИВА,"Скучный ярн пионера и феминистки, который должен вернуть кошку в заброшенном парке развлечений"
944,ВЕРГИННАЯ ДАИСЬ,"Внушающий благоговейный интерес документальный фильм о роботе и безумном учёном, который должен связаться с администратором базы данных в акульем танке"
975,В ЛЮБОЙ ТРЕЙКЕ,"Блестящая панорама лодки и астронавта, которая должна бросить вызов учителю в Манхэттенском пентхаусе"
