film_id,title,description,release_year,language_id,original_language_id,rental_duration,rental_rate,length,replacement_cost,rating,special_features,last_update
944,ВЕРГИННАЯ ДАИСЬ,"Внушающий благоговейный интерес документальный фильм о роботе и безумном учёном, который должен связаться с администратором базы данных в акульем танке",2006,1,,6,4.99,179,29.99,ГУ-13,"Прицепы, за сценами",2006-02-15T04:03:42
951,ЮРИДИЧЕСКАЯ ПРАКТИКА,"Эпическая история о белке и охотнике, который должен побеждать мальчика в заброшенном шахтном шафте",2006,1,,6,0.99,78,28.99,ГУ-13,"Комментаторы, За сценами",2006-02-15T04:03:42
971,БИКИНИ,"Неописуемая история пастора-повара и администратора базы данных, который должен убить феминиста в Конвенции MySQL",2006,1,,4,4.99,109,11.99,ГУ-13,"Комментаторы, Изъятые Сцены, За Сценами",2006-02-15T04:03:42
977,СИДА ВИНДОУ,"Удивительное изучение охотника за женщиной и охотника, который должен сбежать с робота в монастыре",2006,1,,3,2.99,85,25.99,Р,"Удалённые сцены, За сценами",2006-02-15T04:03:42
980,ВИЗАРА КОЛБРЛУД РУКОВОДЯЩИЙ СТРУКТУР,"Недостаток в представлении робота и девушки, которая должна подавить сумо-рестлера на конвенции MySQL",2006,1,,4,4.99,75,12.99,ГУ,"Комментаторы, Изъятые Сцены, За Сценами",2006-02-15T04:03:42
981,ВОЛВЫ ДЕСРЕРЕ,"Быстрая драма белки и робота, который должен суккумировать технического писателя в Манхэттенском пентхаусе",2006,1,,7,0.99,55,13.99,НС-17,За сценами,2006-02-15T04:03:42
983,УНИЧТОЖАЕТСЯ,"Неверный документальный фильм учителя и обезьяны, которые должны подавить Исследователя в U-Boat",2006,1,,7,2.99,105,18.99,ГУ,За сценами,2006-02-15T04:03:42
986,Море Вонка,"Блестящая сага лодки и безумного учёного, который должен встретиться с музой в древней Индии",2006,1,,6,2.99,85,24.99,НС-17,"Прицепы, комментаторы",2006-02-15T04:03:42
996,ЯЗЫК МОЛОДЕЖИ,"Неверный ярн лодки и администратор базы данных, который должен встретить мальчика на первой пилотируемой космической станции",2006,1,,6,0.99,183,9.99,G,"Прицепы, за сценами",2006-02-15T04:03:42
997,Удар молодёжь,"Прикасающаяся драма учителя и кошки, которая должна бросить вызов техническому писателю в U-Boat",2006,1,,4,0.99,179,14.99,НС-17,"Прицепы, за сценами",2006-02-15T04:03:42
999,ФАКТОР ЗОЛАНДЕРА,"Благородное воспоминание о официантке и лодке, которая должна открыть сумо-рестлер в Древнем Китае",2006,1,,5,2.99,101,28.99,Р,"Прицепы, изъятые из эксплуатации",2006-02-15T04:03:42
1000,ЗОРРО АРК,"Вспыльчивая панорама безумного учёного и мальчика, который должен вернуть мальчика в монастырь",2006,1,,3,4.99,50,18.99,НС-17,"Прицепы, комментаторы, за сценами",2006-02-15T04:03:42
