film_id,title,description
695,ПРЕДСЕДАТЕЛЬ БАНГ,"Ужасная панорама технического писателя и музея, который должен сразиться с роботом в Советской Грузии"
698,ГОЛОСОВАНИЕ ПРИЗНАТЕЛЬНОСТИ,"Ужасная ярна пирожного шеф-повара и обезьяны, которые должны сражаться с обезьянами в акульем танке"
700,ПЕРСОНАЛ НЕДЕФФЕКИРОВАННЫЙ,"Потрясающая сага безумного учёного и лодки, который должен победить дантиста в древнем Китае"
711,РАЖИРОВАНИЕ АРПЛАНА,"Удивительная демонстрация секретного агента и технического писателя, который должен сбежать от безумного учёного в джетовом лодке"
714,РАНДОМ УХОДИ,"Ужасная драма фрисби и студента, который должен сразиться с котом в акульем танке"
716,ФЕДЕРАЛЬНЫЙ РУАЙ,"Ужасный пример композитора и сумо-рестлера, который должен бросить вызов безумной корове в конвенции MySQL"
718,РЕБЕЛЬ АРПОРТ,"Внутривенная ярна администратора базы данных и лодки, которая должна выйти замуж за мужа в древней Индии"
720,КОМФОРМЫ ПО БОРЬБЕ С ПРЕКРАЩЕНИЕМ,"Эмоциональный документальный фильм дантиста и женщины, которая должна сражаться с безумным учёным в древнем Китае"
723,МЕСТО ПРОВЕДЕНИЯ ПРЕКРАЩЕНИЯ,"Эмоциональный ярн композитора и человека, который должен сбежать от дворца в Мексиканском заливе"
728,СООТВЕТСТВУЕТ ОТВЕТСТВЕННОСТЬ,"Неверный документальный фильм администратора базы данных и фрисби, который должен вернуть безумного учёного на фабрике в Балуне"
729,РАЙДЕР КАДИСК,"Дыхание обезьяны и обезьяны, которые должны отследить мус в Нигерии"
730,ПОДДЕРЖКА РУКОВОДЯЩИХ ПРИНЦИПОВ,"Неверная драма официантки и композитора, который должен поглотить безумную корову в Древней Японии"
731,Правые краны,"Удовлетворительный характер исследования лодки и кота, который должен найти администратора базы данных в реактивной лодке"
732,ЗВОНИТ СЛЕДУЮЩИЕ ТРУДА,"Удивительная ярна сумо-рестлера и лодки, которая должна побеждать официантку в Новом Орлеане"
751,ТЕНЕНБАУМЫ ТОРНЕГО ПЛАНА,"Разумный документальный фильм о лодке и человеке, который должен встретить лодку в заброшенном доме веселья"
755,САБРИНСКИЙ МЕСТ,"Эмоциональная история белки и крокодила, который должен одеть мужа в пустыне Сахара"
756,СИДЕНЬЯ АНТИТРАСТ,"Потрясающий порыв феминистки и акулы, которые должны сражаться с женщиной в заброшенном доме веселья"
761,САНТА ПАРИЖ,"Эмоциональный документальный фильм о музе и машине, которая должна вернуть безумную корову на фабрике в Балуне"
766,Саваннах Товн,"Внушающая благоговение история астронавта и администратора базы данных, который должен найти секретного агента в Мексиканском заливе"
767,ШКАЛАВАГ ДУК,"Ужасное воспоминание о машине и Учительнице, которые должны встретить официантку в монастыре"
788,ВОНЧЕРАЛЬНАЯ СУДЕБНАЯ СТРУКТУРА,"Ужасная сага обезьяны и фрисби, которая должна сбежать от Исследователя в отъезде"
791,ВОССТАВАЙСЯ ГОСПОДСТВОМ,"Фантастическая сага студентки и девушки, которая должна найти дворецкого в Древней Японии"
796,СЬЕРРА ДИВИДЕ,"Эмоциональный характер исследования фрисби и безумного учёного, который должен построить безумца в Калифорнии"
801,СНИЖАЮЩАЯ СРЕДА,"Ошеломляющая сага дворецкого и женщины, которая должна преследовать исследовательницу в Австралии"
804,Спавшие шутки,"Ошеломляющая мысль о сумо-рестлере и Исследователе, который должен поймать фрисби в конвенции MySQL"
805,Спокойной ночи,"Удивительная Сага музея и пастор, который должен сбежать от дворецкого в Австралии"
806,ЯПОНИЯ СНА,"Эмоциональная эмоция музея и композитора, который должен бороться с техническим писателем в отставке"
810,Углеводы,"Удивительный пример учителя и администратора базы данных, который должен подавить официантку в джетовом лодке"
812,ДВИГАЮЩАЯСЯ БАРБАРЕЛЬЯ,"Недостаток сага безумной коровы и безумного учёного, который должен поглотить кошку в Конвенции MySQL"
815,MONTEZUMA,"Скучное зрелище сумо-рестлера и женщины, которая должна сбежать от человека в канадских скалах"
837,СТАБЛИЦА,"Панорама женщины и фрисби, которая должна отследить крокодил в лодке"
838,АРМАДЖАДОН СТАГЕКЕАКА,"Прикосновение пионера и дворецкого, который должен отследить машину в Калифорнии"
840,ВЫБРОС СТАМИДА,"Неверная история о женщине и люмберджеке, который должен сражаться с фрисби в U-Boat"
846,ПЕРСОНАЛЬНАЯ ПЕРСОНАЛА,"Фантастическая драма фрисби и собаки, которые должны сражаться с безумцем в лодке"
861,ОБЪЯВЛЕНИЯ,"Прикосновение к панораме лумберджека и фрисби, которые должны построить собаку в Австралии"
863,СЛЕДУЮЩИЕ КОНФЕСЦИИ,"Прекрасная демонстрация безумной коровы и собаки, которая должна вернуть официантку в заброшенном парке развлечений"
870,ГОЛД СВАРМ,"Разумная панорама крокодила и лодки, которые должны победить сумо-рестлера в конвенции MySQL"
874,Парк TadPOLE,"Прекрасная история о фрисби и музе, который должен выгнать собаку в заброшенном парке развлечений"
879,ТЕЛЕГРАДСКИЙ ГЛАВ,"Судьба мужа и собаки, которые должны сражаться с официанткой в лодке"
880,СЛЕДУЮЩИЕ ТЕЛЕМАРКИ,"Панорама технического писателя и человека, который должен построить судебно-психиатра в Манхэттенском пентхаусе"
882,КОММАНДАЦИЯ ТЕНЕНБАУМОВ,"Показ первопроходца и человека, который должен достать девушку в Мексиканском заливе"
885,TEXAS НАСТОЯЩЕЕ,"Учительница и учительница, которые должны сражаться с учителем в заброшенном парке развлечений"
887,ФИФ-ФЕЛИКАН,"Дотрагивающийся документальный фильм о безумце и безумном учёном, который должен выгнать феминиста в заброшенном шахтном шафте"
901,КАЙДЕР Трейси,"Прикосновение администратора базы данных и сумасшедшего, который должен построить в Нигерии лумберджек"
909,ОБЪЕДИНЕННАЯ КОММАНД,"Эмоциональная сага автомобиля и безумца, который должен открыть пионера в Калифорнии"
911,ТРИП НЬЮТОН,"Фантастическое исследование стиля и автомобиля, который должен открыть кошку в заброшенном парке развлечений"
919,ТИКУНСНОЕ ОБСЛУЖИВАНИЕ,"Эмоциональный показ мужа и акулы, которые должны суккумировать безумца в Манхэттенском пентхаусе"
922,НЕОФИЦИАЛЬНЫЕ ОБСУЖДЕНИЯ,"Неверное представление о крокодиле и феминистке, который должен преодолеть мозь в заброшенном парке развлечений"
946,ВЕРТАУАЛЬНЫЕ НАРУШЕНИЯ,"Ужасная история об администраторе базы данных и белке, которая должна разоблачить студента в Советской Грузии"
957,ВОЙНЫ,"Скучная драма учителя и сумо-рестлера, который должен бросить вызов секретному агенту в канадских скалистых скалах"
958,ФАНТОМ,"Демонстрация безумной коровы и астронавта, который должен убить машину в древней Индии"
966,АПОЛЛО,"Рассказал о студентке и официантке, которая должна побороть лумберджека в заброшенном шахтном шафте"
973,ЖЕНЩИНЫ,"Побуждающий благоговейный порыв учителя и феминиста, который должен встретить пионера в Древней Японии"
991,ВЕРХНЯЯ БАНГЕР,"Ужасная драма безумца и дантиста, который должен победить мальчика в отставке"
1000,ЗОРРО АРК,"Вспыльчивая панорама безумного учёного и мальчика, который должен вернуть мальчика в монастырь"
