film_id,title,description,release_year,language_id,original_language_id,rental_duration,rental_rate,length,replacement_cost,rating,special_features,last_update
439,МЕСТО ПРОВЕДЕНИЯ СВЕТОТЕНЕВОГО ОЗЕРА,"Прикасающийся ярн фрисби и дантиста, который должен сражаться с композитором в Древней Японии",2006,1,,4,4.99,151,28.99,ГУ-13,"Прицепы, изъятые из эксплуатации",2006-02-15T04:03:42
453,ПРИНЦИП IMAGE,"Панорама секретного агента и крокодила, который должен открыть безумца в канадских скалах",2006,1,,3,2.99,178,17.99,ГУ-13,"Прицепы, комментаторы, изъятые сцены",2006-02-15T04:03:42
457,НЕЗАВИСИМЫЙ ГОЛОС,"Удивительная история о техническом писателе и мальчике, который должен встретить пионера в монастыре",2006,1,,5,0.99,157,21.99,НС-17,"Прицепы, за сценами",2006-02-15T04:03:42
461,ВНУТРЕННИЕ ПЕРСПЕКТИВЫ,"Эпическая показка дворецкого и собаки, которая должна искоренять крокодил в Манхэттенском пентхаусе",2006,1,,3,0.99,123,14.99,НС-17,"Прицепы, комментаторы, за сценами",2006-02-15T04:03:42
471,ОСТРОВНЫЙ ЭКСПЕРТ,"Фантастическая панорама технического писателя и мальчика, который должен найти дантиста в заброшенном доме веселья",2006,1,,7,2.99,84,23.99,НС-17,"Прицепы, комментаторы",2006-02-15T04:03:42
480,СВЕДЕНИЯ ДЕЙСТВИЙ СОТРУДНИКОВ,"Потрясающая демонстрация композитора и собаки, которая должна убить кондитерского шеф-повара в Советской Грузии",2006,1,,3,2.99,84,29.99,Р,"Прицепы, комментаторы, изъятые сцены",2006-02-15T04:03:42
487,ДЖИНГЛ СЕГЕБРУС,"Эпический характер исследования феминистки и студентки, которая должна встретить женщину в балуне",2006,1,,6,4.99,124,29.99,ГУ-13,"Прицепы, комментаторы",2006-02-15T04:03:42
492,ЗАКРЫТОЕ ЗАКРЫТИЕ,"Скучное изучение парня и женщины, которая должна сражаться с астронавтом в Австралии",2006,1,,6,0.99,134,11.99,НС-17,"Прицепы, комментаторы, изъятые сцены",2006-02-15T04:03:42
493,КАНЕ ЭКТОРСИСТ,"Epic Documentary of a Composer and a Robot, который должен одолеть машину в Берлине",2006,1,,5,0.99,92,18.99,Р,"Прицепы, комментаторы",2006-02-15T04:03:42
505,ЛАЙРЕНТНАЯ ЛЕГЬ,"Внушающая благоговение сага композитора и фрисби, который должен посадить пионера в пустыне Сахара",2006,1,,6,2.99,46,24.99,ГУ-13,"Комментаторы, За сценами",2006-02-15T04:03:42
517,УРОКИ КЛОПАТРА,"Эмоциональная демонстрация человека и исследователь, который должен построить мальчика в Манхэттенском пентхаусе",2006,1,,3,0.99,167,28.99,НС-17,"Удалённые сцены, За сценами",2006-02-15T04:03:42
519,МАГЕНТ СВОБОДЫ,"Скучная драма студента и кошки, которые должны поймать технического писателя в Балуне",2006,1,,3,2.99,138,27.99,G,"Комментаторы, Изъятые Сцены, За Сценами",2006-02-15T04:03:42
523,ЛЕГКИЕ СЛУЧАИ,"Неверный порыв собаки и женщины, которая должна сразиться с мухой в Мексиканском заливе",2006,1,,7,0.99,174,21.99,Р,Комментарии,2006-02-15T04:03:42
524,ЛИОНСКИЙ КОНТЕКСТ,"Вспыльчивая демонстрация пастора-повара и кошки, которая должна убить акулу в древнем Китае",2006,1,,6,0.99,50,13.99,ГУ,"Прицепы, изъятые из эксплуатации",2006-02-15T04:03:42
537,ЛЮБОЙ ТРУМАН,"Эмоциональная ярна робота и мальчика, который должен перестрелять технического писателя в U-Boat",2006,1,,3,2.99,75,29.99,G,Прицепы,2006-02-15T04:03:42
538,БЛЮБОЙ НАПАДАЕТ,"Скучная история о машине и батлере, который должен построить девушку в Советской Грузии",2006,1,,7,0.99,162,19.99,ГУ-13,"Прицепы, за сценами",2006-02-15T04:03:42
541,Люк Мумми,"Изучение персонажей мальчика и робота, который должен вернуть безумного учёного в древней Индии",2006,1,,5,2.99,74,21.99,НС-17,"Прицепы, за сценами",2006-02-15T04:03:42
543,Мэдиган Дорадо,"Удивительное изучение акулы и акулы, которая должна открыть крокодил в отставке",2006,1,,5,4.99,116,20.99,Р,"Удалённые сцены, За сценами",2006-02-15T04:03:42
548,ВЕЩЕСТВЕННАЯ ЧИТТА,"Знающая история учителя и охотника, который должен встретиться с безумной коровой в Калифорнии",2006,1,,3,2.99,53,27.99,Р,"Комментаторы, Исключенные сцены",2006-02-15T04:03:42
571,МЕТАЛЛОВЫЙ АРМАГЕДОН,"Ужасное представление о люмберджеке и крокодиле, который должен встретить обезьяну на фабрике в Балуне",2006,1,,6,2.99,161,26.99,ГУ-13,"Прицепы, комментаторы, изъятые сцены",2006-02-15T04:03:42
575,МИДСУММЕРСКИЙ ГРУЗ,"Ужасная панорама мухи и собаки, которая должна отследить крокодил в Древней Японии",2006,1,,3,4.99,48,27.99,G,"Прицепы, изъятые из эксплуатации",2006-02-15T04:03:42
581,Поцелуи МЕНЬШИНСТВ,"Знаменитый показ мухоловки и сумо-рестлера, который должен встретить человека в отставке",2006,1,,4,0.99,59,16.99,G,Прицепы,2006-02-15T04:03:42
590,Деньги ХАРОЛЬД,"Дотрагивающаяся история о Исследователе и лодке, которая должна уничтожить робота в Австралии",2006,1,,3,2.99,135,17.99,ГУ,"Прицепы, комментаторы",2006-02-15T04:03:42
592,МОНСТЕРСКИЙ СТАРТАКУС,"Быстрый рассказ о официантке и кошке, которая должна сражаться с девушкой в Австралии",2006,1,,6,2.99,107,28.99,ГУ,"Комментаторы, За сценами",2006-02-15T04:03:42
603,МОВИ ШЕЙКПЕР,"Разумное представление администратора базы данных и студента, который должен построить охотника в Берлине",2006,1,,6,4.99,53,27.99,ГУ,"Комментаторы, Изъятые Сцены, За Сценами",2006-02-15T04:03:42
606,МУЗЫКИ,"Удовлетворительный характер исследования крокодила и обезьяны, которые должны встретиться с дантистами в Австралии",2006,1,,3,0.99,160,15.99,НС-17,"Прицепы, за сценами",2006-02-15T04:03:42
614,НАЗНАЧЕНИЕ ДЕТЕКТИВНОГО,"Прикасающаяся Сага сумо Рестлера и кошка, которая должна преследовать безумного учёного в Нигерии",2006,1,,5,4.99,178,11.99,ГУ-13,"Прицепы, комментаторы, за сценами",2006-02-15T04:03:42
619,НАЙГОДОРСКИЕ ХАРАКТЕРИСТИКИ,"Фантастическое воспоминание о крокодиле и астронавте, который должен выпустить феминиста в заброшенном парке развлечений",2006,1,,3,0.99,161,20.99,Р,"Прицепы, комментаторы, изъятые сцены",2006-02-15T04:03:42
620,КАМПУС НАМО,"Недостаток обезьяны и белка, которая должна выйти из Женщина в Манхэттенском пентхаусе",2006,1,,5,2.99,131,23.99,НС-17,Прицепы,2006-02-15T04:03:42
632,ШУМЫ,"Разумная драма Исследователя и Женщина, которая должна встретиться с учителем в Калифорнии",2006,1,,5,4.99,145,10.99,НС-17,"Прицепы, за сценами",2006-02-15T04:03:42
633,ОКТЯБРЬ,"Обезьяна и мальчик, который должен встретить мужа в лодке",2006,1,,6,4.99,54,10.99,ГУ-13,"Прицепы, комментаторы, за сценами",2006-02-15T04:03:42
634,ОДДС БУГИ,"Ужасная ярна феминистки и безумца, который должен сразиться с охотником в Берлине",2006,1,,6,0.99,48,14.99,НС-17,"Прицепы, комментаторы, за сценами",2006-02-15T04:03:42
639,ОПЕРАТИВНАЯ НЕЗАВИСИМОСТЬ,"Ужасное зрелище крокодила и музея, который должен убить Исследователя в Нигерии",2006,1,,7,4.99,92,9.99,ГУ,Сцены удалены,2006-02-15T04:03:42
646,ДВИЖЕНИЕ ВЫБРОСОВ,"Неверный ярн администратора базы данных и женщина, которая должна окунуть акулу в U-Boat",2006,1,,6,0.99,169,12.99,НС-17,"Трейлеры, Изъятые сцены, За сценами",2006-02-15T04:03:42
647,ВНЕШНИЙ МАССАКРЕ,"Разумная драма мужа и секретного агента, который должен искать администратора базы данных в древней Индии",2006,1,,4,0.99,129,18.99,НС-17,"Прицепы, изъятые из эксплуатации",2006-02-15T04:03:42
652,ПАДЖАМА ДЖАВБРЕКЕР,"Эмоциональная драма мальчика и технического писателя, который должен вернуть сумо-рестлер в Калифорнии",2006,1,,3,0.99,126,14.99,Р,"Прицепы, изъятые из эксплуатации",2006-02-15T04:03:42
653,ПАНСКИЙ КЛУБ,"Фантастическое представление учителя и крокодила, который должен одеть девушку в балуне",2006,1,,3,4.99,102,15.99,G,"Комментаторы, Исключенные сцены",2006-02-15T04:03:42
659,ПАРК СИТИЗЕН,"Тяжелое зрелище сумо-рестлера и девушки, которая должна встретиться с мужем в Древней Японии",2006,1,,3,4.99,109,14.99,ГУ-13,"Прицепы, изъятые из эксплуатации",2006-02-15T04:03:42
669,ПЕРЛДЕНЦИЯ,"Недостаток астронавта и кондитерского шефа, который должен поглотить собаку в U-Boat",2006,1,,3,2.99,74,10.99,НС-17,Прицепы,2006-02-15T04:03:42
673,ЛАДИСТИЧЕСКИЕ ЛАДИСКИ,"Эпическая сага охотника и технического писателя, который должен завоевать кошку в древней Японии",2006,1,,3,0.99,118,19.99,ГУ-13,"Удалённые сцены, За сценами",2006-02-15T04:03:42
675,ГОЛОСОВАНИЕ ФАНТОМА,"Прекрасный документальный фильм астронавта и крокодила, который должен открыть безумца в монастыре",2006,1,,6,2.99,60,17.99,НС-17,"Комментаторы, За сценами",2006-02-15T04:03:42
689,ЗАГРЯЗНИТЕЛЯ,"Историю сумасшедшего и фрисби, которая должна перестрелять лодку в пустыне Сахара",2006,1,,5,2.99,137,14.99,ГУ,Комментарии,2006-02-15T04:03:42
696,ПРИДЕНЬ АЛАМО,"Разумная драма акулы и криминалистический психолог, который должен искоренять студента в древней Индии",2006,1,,6,0.99,114,20.99,НС-17,Сцены удалены,2006-02-15T04:03:42
699,ЧАСТНЫЙ ГРУЗ,"Потрясающая история технического писателя и охотника, который должен ограбить секретного агента в Балуне",2006,1,,7,4.99,106,26.99,ГУ,Прицепы,2006-02-15T04:03:42
709,EGG RAСЕР,"Эмоциональная демонстрация обезьяны и официантки, которая должна связаться с секретным агентом в Калифорнии",2006,1,,7,2.99,147,19.99,НС-17,"Прицепы, комментаторы, изъятые сцены",2006-02-15T04:03:42
719,ОТЧЕТЫ ЗОРРО,"Удивительная драма безумного учёного и композитора, который должен построить мужа в отставке",2006,1,,7,4.99,182,11.99,ГУ,За сценами,2006-02-15T04:03:42
725,ПРОСЬБА ТИКУНА,"Неверный характер исследования кошки и администратора базы данных, который должен искать учителя в монастыре",2006,1,,6,4.99,167,25.99,Р,"Прицепы, комментаторы, за сценами",2006-02-15T04:03:42
734,АВТОДОРОЖНАЯ РОКСАННА,"Скучное изучение официантки и астронавта, которые должны бороться с крокодилом в Древней Японии",2006,1,,4,4.99,158,12.99,Р,За сценами,2006-02-15T04:03:42
744,Ротсы помнишь,"Блестящая драма безумной коровы и охотника, который должен сбежать с охотником в Берлине",2006,1,,4,0.99,89,23.99,ГУ-13,"Комментаторы, Изъятые Сцены, За Сценами",2006-02-15T04:03:42
755,САБРИНСКИЙ МЕСТ,"Эмоциональная история белки и крокодила, который должен одеть мужа в пустыне Сахара",2006,1,,5,4.99,99,11.99,ГУ,"Прицепы, за сценами",2006-02-15T04:03:42
757,САЖЕБРУССКИЙ КЛАСС,"Яркая история о лумберджеке и охотнике, который должен убить мальчика в Древней Японии",2006,1,,4,2.99,106,28.99,G,Прицепы,2006-02-15T04:03:42
759,САЛУТЕ ПОЛЛО,"Внушающий благоговение характер исследования мальчика и феминистки, которые должны выпить крокодил в Древнем Китае",2006,1,,4,2.99,73,29.99,Р,"Прицепы, комментаторы, Изъятые сцены, За сценами",2006-02-15T04:03:42
765,НАЗНАЧЕНИЕ СУБЪЕКТА,"Ужасный поступок дворецкого и мальчика, который должен вернуть учителя в Берлине",2006,1,,7,4.99,182,18.99,Р,"Прицепы, комментаторы, Изъятые сцены, За сценами",2006-02-15T04:03:42
766,Саваннах Товн,"Внушающая благоговение история астронавта и администратора базы данных, который должен найти секретного агента в Мексиканском заливе",2006,1,,5,0.99,84,25.99,ГУ-13,"Комментаторы, Изъятые Сцены, За Сценами",2006-02-15T04:03:42
768,КАРФАСНЫЙ БАНГ,"Эмоциональная ярна учителя и девушки, которая должна найти учителя на фабрике в Балуне",2006,1,,3,4.99,102,11.99,ГУ-13,"Комментаторы, Исключенные сцены",2006-02-15T04:03:42
770,СИСИСОРХАНЫ СЛУМЫ,"Восторженная драма девушки и технического писателя, который должен встретиться с феминисткой в канадской скале",2006,1,,5,2.99,147,13.99,G,"Комментаторы, Изъятые Сцены, За Сценами",2006-02-15T04:03:42
786,ШЕФЕРД МИДСУММЕР,"Знаменитая драма робота и Женщина, которая должна убить Ламберджека в Балуне",2006,1,,7,0.99,113,14.99,Р,Сцены удалены,2006-02-15T04:03:42
787,Шипячие кусочки,"Внушающий благоговение характер исследования астронавта и судебно-психиатра, который должен бросить вызов безумцу в Древней Индии",2006,1,,4,0.99,125,12.99,G,"Прицепы, комментаторы, Изъятые сцены, За сценами",2006-02-15T04:03:42
791,ВОССТАВАЙСЯ ГОСПОДСТВОМ,"Фантастическая сага студентки и девушки, которая должна найти дворецкого в Древней Японии",2006,1,,3,4.99,167,24.99,ГУ-13,Сцены удалены,2006-02-15T04:03:42
795,МЕЖПРАВИТЕЛЬСТВЕННАЯ СТРУКТУРА,"Скучная история о фрисби и крокодиле, который должен победить музу в заброшенном шахтном шафте",2006,1,,7,0.99,111,23.99,Р,"Прицепы, изъятые из эксплуатации",2006-02-15T04:03:42
796,СЬЕРРА ДИВИДЕ,"Эмоциональный характер исследования фрисби и безумного учёного, который должен построить безумца в Калифорнии",2006,1,,3,0.99,135,12.99,НС-17,"Комментаторы, Исключенные сцены",2006-02-15T04:03:42
812,ДВИГАЮЩАЯСЯ БАРБАРЕЛЬЯ,"Недостаток сага безумной коровы и безумного учёного, который должен поглотить кошку в Конвенции MySQL",2006,1,,7,0.99,50,13.99,ГУ-13,За сценами,2006-02-15T04:03:42
817,ЭВОЛЮЦИЯ СОЛДЕЙСТВИЙ,"Панорама акулы и пионера, который должен встретить студента на первой пилотируемой космической станции",2006,1,,7,4.99,185,27.99,Р,"Прицепы, комментаторы, Изъятые сцены, За сценами",2006-02-15T04:03:42
818,Что-то херня.,"Скучное изучение машины и мужа, который должен перестрелять фрисби на первой пилотируемой космической станции",2006,1,,4,4.99,180,17.99,НС-17,"Комментаторы, За сценами",2006-02-15T04:03:42
819,Песня ХЕДВИГ,"Удивительный документальный фильм о мужчине и муже, который должен встретить белку на конвенции MySQL",2006,1,,3,0.99,165,29.99,ГУ-13,"Прицепы, изъятые из эксплуатации",2006-02-15T04:03:42
832,НОАССКИЙ ГУМАН,"Таут Сага крокодил и лодка, которые должны побеждать охотника в акульем танке",2006,1,,5,0.99,175,16.99,ГУ,"Прицепы, комментаторы, Изъятые сцены, За сценами",2006-02-15T04:03:42
837,СТАБЛИЦА,"Панорама женщины и фрисби, которая должна отследить крокодил в лодке",2006,1,,4,2.99,85,19.99,ГУ,"Комментаторы, За сценами",2006-02-15T04:03:42
842,ОТХОДЫ ГОСУДАРСТВА,"Прекрасная показка кота и пирожного шеф-повара, который должен выйти из безумной коровы в лодке",2006,1,,4,2.99,113,13.99,НС-17,"Прицепы, комментаторы, Изъятые сцены, За сценами",2006-02-15T04:03:42
845,СВЯЗЬ С ТЕМПОМОМ,"Прикоснувшись к крокодилу и учителю, который должен построить судебно-медицинского психолога в Конвенции MySQL",2006,1,,7,4.99,48,9.99,НС-17,"Удалённые сцены, За сценами",2006-02-15T04:03:42
848,СТОННЫЙ ПОЖАР,"Бесстрашная драма астронавта и крокодила, который должен найти лодку в Советской Грузии",2006,1,,3,0.99,94,19.99,G,Прицепы,2006-02-15T04:03:42
849,СТОРМСКАЯ ПОМОЩЬ,"Знаменитая драма феминистки и акулы, которые должны искоренять лодку в акульем танке",2006,1,,6,0.99,57,28.99,НС-17,"Прицепы, комментаторы, за сценами",2006-02-15T04:03:42
850,СПРАВОЧНАЯ ОСНОВА,"Недостаток сага мальчика и кошки, который должен выпить дантиста в заброшенном шахтном шафте",2006,1,,7,0.99,163,27.99,Р,"Прицепы, за сценами",2006-02-15T04:03:42
855,ТРАНСГРАНИЧНЫЙ РУКОВОДЯЩИЙ СТРУКТУР,"Удивительное исследование охотника и официантки, которая должна выпить человека в Новом Орлеане",2006,1,,7,0.99,132,28.99,ГУ-13,"Прицепы, за сценами",2006-02-15T04:03:42
865,СУНРИСЬ ЛЕГЬ,"Прекрасный порыв безумца и дворецкого, который должен встретиться с крокодилом в Манхэттенском пентхаусе",2006,1,,3,4.99,135,19.99,ГУ-13,За сценами,2006-02-15T04:03:42
875,ТАЛИЗИРОВАННЫЙ ГОМИСИД,"Панорама дантиста и судебно-психиатра, который должен отправить пионера в U-Boat",2006,1,,6,0.99,173,9.99,ГУ,"Комментаторы, Изъятые Сцены, За Сценами",2006-02-15T04:03:42
893,ТИТАНЫ ИЕРКИ,"Неверная панорама феминистки и сумо-рестлер, который должен бросить вызов техническому писателю в древнем Китае",2006,1,,4,4.99,91,11.99,ГУ,За сценами,2006-02-15T04:03:42
898,ТУРИСТ ПЕЛИКАН,"Скучающая история дворецкого и астронавта, который должен выйти за пионера в Австралии",2006,1,,4,4.99,152,18.99,ГУ-13,Сцены удалены,2006-02-15T04:03:42
910,Забота о ДЖЕКИЛЛЕ,"Скучная история учителя и студента, который должен перестрелять кошку в заброшенном шахтном шафте",2006,1,,3,0.99,87,19.99,ГУ,"Трейлеры, Изъятые сцены, За сценами",2006-02-15T04:03:42
912,Завтра,"Поразительная панорама мужа и сумо-рестлера, который должен следовать за лодкой в древней Индии",2006,1,,3,2.99,52,9.99,ГУ,"Комментаторы, Исключенные сцены",2006-02-15T04:03:42
918,СВЯЗАННЫЕ ПИРАТЫ,"Прикосновение фрисби и лодки, которые должны убить девочку на конвенции MySQL",2006,1,,4,4.99,152,23.99,ГУ,"Прицепы, комментаторы, изъятые сцены",2006-02-15T04:03:42
937,ТРЕБУЕМЫЙ ТРИП БОРЬБЫ С БОРЬБОЙ,"Исследование астронавта и исследователь, который должен достичь обезьяны в Конвенции MySQL",2006,1,,7,2.99,85,14.99,НС-17,"Комментаторы, Исключенные сцены",2006-02-15T04:03:42
