film_id,title,description,release_year,language_id,original_language_id,rental_duration,rental_rate,length,replacement_cost,rating,special_features,last_update
1,АКАДЕМИЯ ДИНСАУР,"Эпическая драма феминистки и безумного учёного, который должен сражаться с учителем в канадских скалах",2006,1,,6,0.99,86,20.99,ГУ,"Удалённые сцены, За сценами",2006-02-15T04:03:42
4,ПЕРСПЕКТИВНОЕ ДЕЙСТВИЕ,"Фантастический документальный фильм о фрисби и лумберджеке, который должен отследить обезьяну в акульем танке",2006,1,,5,2.99,117,26.99,G,"Комментаторы, За сценами",2006-02-15T04:03:42
5,АФРИКАНСКИЙ ЭГГ,"Быстрый документальный пастор-повар и дантист, который должен преследовать судебно-психиатра в Мексиканском заливе",2006,1,,6,2.99,130,22.99,G,Сцены удалены,2006-02-15T04:03:42
14,АЛИСИЯ ФАНТАЗИЯ,"Эмоциональная драма акулы и администратор базы данных, который должен победить пионера в Советской Грузии",2006,1,,6,0.99,94,23.99,НС-17,"Трейлеры, Изъятые сцены, За сценами",2006-02-15T04:03:42
15,ИНОСТРАННЫЙ ЦЕНТР,"Блестящая драма кота и безумного учёного, который должен сражаться с феминистом на конвенции MySQL",2006,1,,5,2.99,46,10.99,НС-17,"Прицепы, комментаторы, за сценами",2006-02-15T04:03:42
21,АМЕРИКАНСКИЙ ЦЕРКУС,"Разумная драма девушки и астронавта, которая должна встретиться с администратором базы данных в акульем танке",2006,1,,3,4.99,129,17.99,Р,"Комментаторы, За сценами",2006-02-15T04:03:42
28,АНТИМ ЛЮК,"Прикосновение к панораме официантки и женщины, которая должна выгнать собаку в заброшенном парке развлечений",2006,1,,5,4.99,91,16.99,ГУ-13,"Удалённые сцены, За сценами",2006-02-15T04:03:42
29,АНТИТРУТНЫЕ ПОТОМКИ,"Ужасная ярна женщины и феминистки, которые должны украсть администратора базы данных в древней Индии",2006,1,,5,2.99,168,11.99,НС-17,"Прицепы, комментаторы, изъятые сцены",2006-02-15T04:03:42
35,АРАХНОФОБИЯ РОЛЛЕОРЧЕСКИЙ ОХРАННИК,"Взятое в действие отражение пекарского шеф-повара и композитора, который должен открыть безумного стипендиата на первой пилотируемой космической станции",2006,1,,4,2.99,147,24.99,ГУ-13,"Трейлеры, Изъятые сцены, За сценами",2006-02-15T04:03:42
44,Ненавидят,"Быстрая панорама технического писателя и сумасшедшего стипендиата, который должен найти феминиста в заброшенном шахтном шафте",2006,1,,5,4.99,113,21.99,ГУ-13,"Прицепы, за сценами",2006-02-15T04:03:42
48,Задняя часть,"Потрясающий характер исследования безумного учёного и безумного коровы, который должен убить машину в монастыре",2006,1,,3,4.99,118,24.99,ГУ-13,"Прицепы, за сценами",2006-02-15T04:03:42
49,Плохой человек.,"Эмоциональная панорама пионера и композитора, который должен сбежать от безумного учёного в лодке",2006,1,,6,2.99,162,22.99,Р,"Прицепы, комментаторы, за сценами",2006-02-15T04:03:42
60,БЕЖЕНЦАТАЯ ГУМАНКА,"Побуждает благоговейный порыв студента и белки, которые должны позорить мальчика в Древнем Китае",2006,1,,3,4.99,89,22.99,Р,"Удалённые сцены, За сценами",2006-02-15T04:03:42
66,БЕНЯ РОШЬ,"Поразительная панорама человека и обезьяны, которые должны открыть человека на первой пилотируемой космической станции",2006,1,,6,0.99,53,27.99,НС-17,"Комментаторы, Исключенные сцены",2006-02-15T04:03:42
68,БЕЖЕНЧЕСКАЯ РАБОТА,"Эмоциональный характер изучения лодки и пионера, который должен найти исследователя в акульем танке",2006,1,,5,4.99,122,26.99,НС-17,"Комментаторы, Изъятые Сцены, За Сценами",2006-02-15T04:03:42
76,КАСПЕР БРИДЖЕ,"Быстрая Сага фрисби и астронавта, который должен победить феминистку в Древней Индии",2006,1,,4,0.99,103,23.99,НС-17,"Комментаторы, Изъятые Сцены, За Сценами",2006-02-15T04:03:42
81,БЛИЖНЕГО СЛЕДУЕТ,"Прикасающаяся драма робота и дантиста, который должен встретить охотника на лодке",2006,1,,6,4.99,103,29.99,ГУ-13,"Прицепы, за сценами",2006-02-15T04:03:42
91,ГРУЗОВЫЙ КОЛИЧЕСТВО,"Ужасная панорама администратора базы данных и астронавта, который должен бросить вызов лумберджеку в Балуне",2006,1,,5,0.99,98,17.99,ГУ,За сценами,2006-02-15T04:03:42
94,ЧЕЛОВЕЧЕСКОЕ СОСТОЯНИЕ,"Рассказ о собаке и пасторе, который должен сражаться с девушкой в Берлине",2006,1,,7,2.99,176,14.99,ГУ-13,"Прицепы, изъятые из эксплуатации",2006-02-15T04:03:42
96,ДВИЖЕНИЕ ДОМА,"Прекрасная демонстрация секретного агента и обезьяны, которые должны сражаться с сумо-рестлером в заброшенном шахтном шафте",2006,1,,4,2.99,169,21.99,ГУ-13,"Прицепы, комментаторы",2006-02-15T04:03:42
109,БУТТЕРФЛИЧНЫЙ ЧОКОЛАТ,"Ужасная история о девушке и композиторе, который должен побеждать мужа в акульем танке",2006,1,,3,0.99,89,17.99,G,За сценами,2006-02-15T04:03:42
116,КАНДИДАТНЫЙ ПЕРИОД,"Блестящий пример композитора и администратора базы данных, который должен победить безумного учёного на первой пилотируемой космической станции",2006,1,,4,2.99,70,10.99,Р,"Удалённые сцены, За сценами",2006-02-15T04:03:42
118,КАНЬОН СТОК,"Разумное воспоминание о официантке и феминистке, которая должна сбежать из белки в Манхэттенском пентхаусе",2006,1,,7,0.99,85,26.99,Р,"Прицепы, изъятые из эксплуатации",2006-02-15T04:03:42
124,КАСПЕР ДРАГОНФЛИ,"Беспощадный документальный фильм о лодке и крокодиле, который должен охотиться за роботом в пустыне Сахара",2006,1,,3,4.99,163,16.99,ГУ-13,Прицепы,2006-02-15T04:03:42
130,КОЛИЧЕСТВО СЕЛЬСКОХОЗЯЙСТВЕННОСТИ,"Удивительный документальный фильм о секретном агенте и астронавте, который должен искоренять охотника в акульем танке",2006,1,,7,0.99,110,24.99,ГУ-13,"Удалённые сцены, За сценами",2006-02-15T04:03:42
131,ЦЕНТРНЫЙ ДИНСАУР,"Прекрасный характер исследования сумо Рестлера и дантиста, который должен найти собаку в Калифорнии",2006,1,,5,4.99,152,12.99,ГУ,Сцены удалены,2006-02-15T04:03:42
144,ГЛАДИКАТОР ЧИТОНОВАН,"Блестящая панорама технического писателя и лумберджека, который должен сбежать от дворецкого в древней Индии",2006,1,,7,4.99,61,24.99,ГУ,"Прицепы, комментаторы, изъятые сцены",2006-02-15T04:03:42
146,ЦЫПЛЕНОК,"Скучное зрелище лодки и администратор базы данных, который должен убить сумо-рестлера на первой пилотируемой космической станции",2006,1,,6,2.99,107,24.99,G,Комментарии,2006-02-15T04:03:42
152,КОРСКАЯ МОЛОДЕЖИ,"Разумная драма пастора-повара и дантиста, который должен преследовать девушку в Балуне",2006,1,,5,2.99,90,13.99,ГУ-13,"Трейлеры, Изъятые сцены, За сценами",2006-02-15T04:03:42
153,ГРАЖДАНСКАЯ СЕКРЕТАРЯ,"Фантастическое исследование технического писателя и мужа, который должен вернуть робота в отставку",2006,1,,7,0.99,165,18.99,G,"Комментаторы, Исключенные сцены",2006-02-15T04:03:42
154,КЛАШСКАЯ ПОМОЩЬ,"Удивительная ярна композитора и белочки, которые должны сбежать от астронавта в Австралии",2006,1,,6,2.99,81,12.99,G,"Комментаторы, Исключенные сцены",2006-02-15T04:03:42
159,ЗАКРЫВАЮЩАЯСЯ ЧАСТЬ,"Неверная панорама фрисби и охотника, который должен победить обезьяну в древней Индии",2006,1,,5,4.99,58,12.99,Р,"Прицепы, за сценами",2006-02-15T04:03:42
164,КРАЙНЯЯ РЫНКА,"Поразительный документальный фильм о безумной коре и пионере, который должен бросить вызов дворецкому в пустыне Сахара",2006,1,,4,0.99,55,20.99,ГУ,"Прицепы, комментаторы, Изъятые сцены, За сценами",2006-02-15T04:03:42
165,КОЛБЛИЧНОЕ УСТРОЙСТВО,"Блестящая панорама дантиста и музея, которые должны найти студента в Мексиканском заливе",2006,1,,7,4.99,70,27.99,G,"Прицепы, изъятые из эксплуатации",2006-02-15T04:03:42
166,ПОЛОР ФИЛАДЕЛЬФИЯ,"Разумная панорама автомобиля и крокодила, который должен выпить обезьяну в пустыне Сахара",2006,1,,6,2.99,149,19.99,G,"Комментаторы, За сценами",2006-02-15T04:03:42
172,КОНТЕЙДСКИЕ СТРУКТУРЫ,"Прикасающаяся история о женщине и композиторе, который должен преследовать мужа в Нигерии",2006,1,,7,4.99,112,12.99,НС-17,"Удалённые сцены, За сценами",2006-02-15T04:03:42
177,КОНКУРЕНЦИОННЫЙ ПРИЦЕП,"Неверная драма крокодила и безумной коровы, которая должна дотянуться до дантиста в акульем танке",2006,1,,4,4.99,172,20.99,Р,"Комментаторы, Исключенные сцены",2006-02-15T04:03:42
178,СОСТОЯНИЕ МИКРОКОСМОС,"Ужасный документальный фильм о крокодиле и муже, который должен встретиться с мужем на первой пилотируемой космической станции",2006,1,,6,0.99,115,25.99,G,"Удалённые сцены, За сценами",2006-02-15T04:03:42
181,КОНТАКТНЫЙ АНАЛИЗ,"Разумное представление акулы и обезьяны, которые должны встретиться с администратором базы данных в древней Индии",2006,1,,7,2.99,166,10.99,ГУ-13,Комментарии,2006-02-15T04:03:42
188,Сумасшедший дом,"Фантастическая панорама мальчика и женщины, которая должна искоренять администратора базы данных в отставке",2006,1,,7,2.99,136,24.99,ГУ,"Комментаторы, Исключенные сцены",2006-02-15T04:03:42
191,КРУГЛЫЕ РУКОВОДЯЩИЕ ПРИНЦИПЫ,"Неверная драма охотника и администратор базы данных, который должен сразиться с крокодилом в заброшенном парке развлечений",2006,1,,6,0.99,143,27.99,ГУ-13,"Комментаторы, Изъятые Сцены, За Сценами",2006-02-15T04:03:42
193,ТРАНСГРАНИЧНЫЕ СЛУЧАИ,"Бесстрашная документальная грамота сумо Рестлера и астронавта, который должен сражаться с композитором в отставке",2006,1,,5,2.99,153,20.99,G,"Прицепы, комментаторы, за сценами",2006-02-15T04:03:42
202,Папа Питтсбург,"Эпическая история акулы и студента, который должен сразиться с исследовательницей в Мексиканском заливе",2006,1,,5,4.99,161,26.99,G,"Удалённые сцены, За сценами",2006-02-15T04:03:42
206,Пляж на танцах,"Потрясающая история о Исследователе и судебно-психиатре, который должен встретиться с крокодилом в акульем танке",2006,1,,6,0.99,144,25.99,G,"Комментаторы, За сценами",2006-02-15T04:03:42
216,ДЕНЬ ФИНАНСИРОВАНИЯ,"Ошеломляющий документальный фильм композитора и безумного учёного, который должен найти технического писателя в U-Boat",2006,1,,3,4.99,113,16.99,G,"Прицепы, комментаторы, Изъятые сцены, За сценами",2006-02-15T04:03:42
227,УПАКОВКА ЗАДЕРЖАННЫХ,"Эпическая сага официантки и композитора, который должен встретиться с лодкой в U-Boat",2006,1,,4,4.99,88,17.99,Р,"Комментаторы, Исключенные сцены",2006-02-15T04:03:42
238,ДОКТОР ГРАЙЛЬ,"Знаменитая драма о женщине и официантке, которая должна связаться с судебно-психиатром в отставке",2006,1,,4,2.99,57,29.99,G,"Прицепы, комментаторы, за сценами",2006-02-15T04:03:42
250,ДРАГОНСКИЙ КВАД,"Великолепное воспоминание о мальчике и официантке, которая должна перестрелять учителя в Древнем Китае",2006,1,,4,0.99,170,26.99,НС-17,"Удалённые сцены, За сценами",2006-02-15T04:03:42
254,ВОДИТЕЛЯ АННИ,"Недостаток в образе дворецкого и автомобиля, который должен вернуть лодку в заброшенном доме веселья",2006,1,,4,2.99,159,11.99,ГУ-13,"Трейлеры, Изъятые сцены, За сценами",2006-02-15T04:03:42
255,ПОЛИШКА ВОДИТЕЛЯ,"Ярн феминиста и технического писателя, который должен поглотить лодку в заброшенном шахтном шафте",2006,1,,6,4.99,175,21.99,НС-17,"Прицепы, изъятые из эксплуатации",2006-02-15T04:03:42
258,ДИНАМИТ НАД НАРКОТИЧЕСКИМИ СРЕДСТВАМИ,"Эпическая показка крокодила и крокодила, который должен встретить собаку в заброшенном парке развлечений",2006,1,,6,0.99,96,11.99,ГУ,Прицепы,2006-02-15T04:03:42
276,ЭЛЕМЕНТЫ,"Потрясающее воспоминание о официантке и белке, которая должна убить безумную корову в джетовом лодке",2006,1,,6,4.99,115,28.99,НС-17,"Комментаторы, За сценами",2006-02-15T04:03:42
289,ЭВМЕННОЕ ВОЗДЕЙСТВИЕ,"Внушающий благоговение ярн пастора и администратор базы данных, который должен бросить вызов учителю в балуне",2006,1,,5,4.99,66,25.99,G,"Прицепы, комментаторы, изъятые сцены",2006-02-15T04:03:42
292,ЭВМ &lt; &lt; ЭКСПЛУАТАЦИОННЫЙ ЭВМ &gt; &gt;,"Блестящий документальный фильм о обезьяне и машине, которая должна завоевать крокодил в акульем танке",2006,1,,3,0.99,51,20.99,G,Комментарии,2006-02-15T04:03:42
296,ПОЛНОМОЧИЯ,"Скучная драма астронавта и лодки, которая должна встретиться с лодкой в Калифорнии",2006,1,,5,2.99,178,23.99,Р,Прицепы,2006-02-15T04:03:42
298,Айс драйвинг,"Ужасная история о кошке и официантке, которая должна сражаться с исследовательницей в отставке",2006,1,,4,2.99,172,13.99,ГУ-13,"Прицепы, комментаторы",2006-02-15T04:03:42
306,МЕТАЛЛ,"Разумная ярна обезьяны и учительница, которая должна найти собаку в Австралии",2006,1,,3,0.99,104,12.99,ГУ-13,"Прицепы, изъятые из эксплуатации",2006-02-15T04:03:42
310,ВСЕОБЪЕМЛЮЩЕЕ,"Разумная панорама кошки и лодки, которые должны повредить лодку в Мексиканском заливе",2006,1,,5,4.99,158,20.99,Р,"Комментаторы, Исключенные сцены",2006-02-15T04:03:42
321,FLASH WARS,"Потрясающая Сага муз и пастор-повар, который должен отследить студента в Мексиканском заливе",2006,1,,3,4.99,123,21.99,НС-17,"Прицепы, комментаторы, за сценами",2006-02-15T04:03:42
323,МЯСО СВЕТА,"Потрясающий характер изучения крокодила и пионера, который должен преследовать учителя в Новом Орлеане",2006,1,,7,4.99,179,22.99,Р,Прицепы,2006-02-15T04:03:42
330,ФОРМЕНТЫ КОМАНЧЕРО,"Ужасная история о белке и судебно-психиатре, который должен спасти человека в Нигерии",2006,1,,7,4.99,112,22.99,НС-17,"Прицепы, за сценами",2006-02-15T04:03:42
331,ПЕРСПЕКТИВЫ,"Удивительное представление о судебно-психиатре и безумном учёном, который должен бросить вызов девушке в Новом Орлеане",2006,1,,6,2.99,90,25.99,НС-17,"Прицепы, комментаторы, за сценами",2006-02-15T04:03:42
337,ФРИДА СЛИППЕР,"Ужасная история о Ламберджеке и машине, которая должна сбежать на лодке в заброшенном шахтном шафте",2006,1,,6,2.99,73,11.99,Р,"Прицепы, изъятые из эксплуатации",2006-02-15T04:03:42
344,ЧРЕЗВЫЧАЙНОЕ УБЕЖДЕНИЕ,"Недостаток памяти лодки и судебно-психиатра, который должен сражаться с официанткой в монастыре",2006,1,,3,0.99,178,28.99,ГУ-13,Сцены удалены,2006-02-15T04:03:42
347,ГАМЫ БЛИЖАЙШИЕ,"Поразительный документальный фильм о дворецком и Исследователе, который должен бросить вызов дворецкому в монастыре",2006,1,,7,4.99,119,17.99,ГУ-13,За сценами,2006-02-15T04:03:42
355,ГОСТУСТЫ ЭТО,"Разумный порыв собаки и феминистки, которые должны отследить композитора в Берлине",2006,1,,7,0.99,101,18.99,Р,"Трейлеры, Изъятые сцены, За сценами",2006-02-15T04:03:42
360,ГЛАСНОЕ ДИНАМЕНИЕ,"Поразительная драма фрисби и астронавта, которые должны сражаться с собакой в Древней Японии",2006,1,,4,0.99,103,24.99,G,Прицепы,2006-02-15T04:03:42
362,ГЛОБАЛЬНАЯ ПРОСТРАНСТВА,"Удивительная Сага женщины и Женщина, которая должна открыть кошку на первой пилотируемой космической станции",2006,1,,7,2.99,115,13.99,ГУ-13,"Прицепы, комментаторы, за сценами",2006-02-15T04:03:42
370,ГОРОДСКИЕ БИНПО,"Демонстрация сумо-рестлера и машины, которая должна превзойти официантку на фабрике в Балуне",2006,1,,4,2.99,108,26.99,Р,"Удалённые сцены, За сценами",2006-02-15T04:03:42
387,ГОН БОННИ,"Скучное представление сумо-рестлера и мужа, который должен построить официантку в Мексиканском заливе",2006,1,,7,0.99,100,27.99,G,За сценами,2006-02-15T04:03:42
399,НАСТОЯЩИЕ СВОБОДЫ,"Панорама мужа и феминистки, которые должны встретиться с судебно-психиатром в Древней Японии",2006,1,,6,2.99,100,23.99,G,Сцены удалены,2006-02-15T04:03:42
401,ГАРОЛД ФРАНЦИЯ,"Потрясающая сага сумо-рестлера и студента, который должен выйти из мухи в пустыне Сахара",2006,1,,6,0.99,168,10.99,НС-17,"Комментаторы, Изъятые Сцены, За Сценами",2006-02-15T04:03:42
403,Гарри Идао,"Таут-Ярн технического писателя и феминиста, который должен выгнать собаку из Калифорнии",2006,1,,5,4.99,121,18.99,ГУ-13,"Комментаторы, Исключенные сцены",2006-02-15T04:03:42
414,ЭЛЕКТРОННЫЕ СЬЕРРА,"Дыхание акулы и дантиста, который должен сражаться с лодкой в Советской Грузии",2006,1,,3,2.99,75,23.99,ГУ,"Удалённые сцены, За сценами",2006-02-15T04:03:42
415,ВЫСОКОЕ ЭНКИНО,"Ужасная Сага официантки и охотника, который должен выйти из сумо-рестлера в Австралии",2006,1,,3,2.99,84,23.99,Р,"Прицепы, комментаторы, за сценами",2006-02-15T04:03:42
428,ГОМИКИДНАЯ ГОЛЯ,"Поразительный документальный фильм о охотнике и мальчике, который должен встретить мальчика на конвенции MySQL",2006,1,,6,2.99,141,21.99,ГУ-13,Комментарии,2006-02-15T04:03:42
433,РАБОТА,"Потрясающее представление о безумном учёном и техническом писателе, который должен сложить обезьяну в акульем танке",2006,1,,4,2.99,95,23.99,ГУ,Прицепы,2006-02-15T04:03:42
437,ДИНАМИТ Дома,"История первопроходца и белки, которая должна сразиться со студентом в Советской Грузии",2006,1,,7,2.99,109,13.99,Р,"Комментаторы, Изъятые Сцены, За Сценами",2006-02-15T04:03:42
