film_id,title,description
26,АННОТИРОВАННОСТЬ,"Удивительная панорама пекарского шеф-повара и лодки, которая должна сбежать от женщины в заброшенном парке развлечений"
29,АНТИТРУТНЫЕ ПОТОМКИ,"Ужасная ярна женщины и феминистки, которые должны украсть администратора базы данных в древней Индии"
35,АРАХНОФОБИЯ РОЛЛЕОРЧЕСКИЙ ОХРАННИК,"Взятое в действие отражение пекарского шеф-повара и композитора, который должен открыть безумного стипендиата на первой пилотируемой космической станции"
37,АРИЗОНА БАНГ,"Блестящая панорама безумного учёного и безумного коровы, которая должна встретить пионера в монастыре"
44,Ненавидят,"Быстрая панорама технического писателя и сумасшедшего стипендиата, который должен найти феминиста в заброшенном шахтном шафте"
48,Задняя часть,"Потрясающий характер исследования безумного учёного и безумного коровы, который должен убить машину в монастыре"
60,БЕЖЕНЦАТАЯ ГУМАНКА,"Побуждает благоговейный порыв студента и белки, которые должны позорить мальчика в Древнем Китае"
63,БРАЗЫВШИЕСЯ В РАМКАХ,"Удивительное исследование о безумце и роботе, который должен встретиться с безумным учёным в заброшенном доме веселья"
65,ПОВЕЩАТЕЛЬНЫЙ РУНАЙ,"Неверная драма студента и мужа, который должен выйти из сумо-рестлера в Берлине"
66,БЕНЯ РОШЬ,"Поразительная панорама человека и обезьяны, которые должны открыть человека на первой пилотируемой космической станции"
70,БИКИНИСКИЕ БОРРОУРЫ,"Поразительная драма астронавта и кошки, которая должна открыть женщину на первой пилотируемой космической станции"
81,БЛИЖНЕГО СЛЕДУЕТ,"Прикасающаяся драма робота и дантиста, который должен встретить охотника на лодке"
82,БЛИЖНИЕ АРГОНАУТЫ,"Скучная драма Исследователя и человека, который должен убить лумберджека в Манхэттенском пентхаусе"
84,ГРУЗОВЫЕ ДАРЕСЫ,"Историю официантки и собаки, которая должна открыть дантиста в Древней Японии"
85,БОННИ ГОЛОКАУСТ,"Быстрая история о крокодиле и роботе, который должен найти мус в Древней Японии"
100,БРООКЛИН ДЕРЕРТ,"Прекрасная драма дантиста и композитора, который должен сражаться с сумо-рестлером на первой пилотируемой космической станции"
101,БРОДУШНЫЙ БЛАНКЕТ,"Удовлетворительный характер исследования дворецкого и технического писателя, который должен поглотить астронавта в древней Японии"
127,КОНТЕЙДСКИЕ УСТРОЙСТВА,"Быстрая панорама девушки и акулы, которые должны сразиться с мальчиком в древней Индии"
128,КАТХ МАССАД,"Скучное воспоминание о Ламберджеке и феминистке, который должен открыть женщину в Нигерии"
139,ВОССТАНОВЛЯЮЩАЯ ВЕЩЕСТВА,"Поражающая Сага технического писателя и дворецкого, который должен сражаться с дворецким в акульем танке"
140,КЛАЙД КОРОЛЕВСТВА,"Эмоциональный характер изучения пионера и девушки, которая должна открыть собаку в древней Японии"
165,КОЛБЛИЧНОЕ УСТРОЙСТВО,"Блестящая панорама дантиста и музея, которые должны найти студента в Мексиканском заливе"
168,КАМАНЧЕРУСЫ В СВЯЗИ С ЭТИМ,"Скучная сага обезьяны и обезьяны, которые должны найти обезьяну в Мексиканском заливе."
171,ОБЪЯВЛЕНИЯ,"Фантастическая сага студента и безумного учёного, который должен сражаться с охотником в оставленных шахтах"
173,МАГУАРИИ КОНФЕССИОНАЦИИ,"Рассказ о машине и мальчике, который должен сражаться с писателем-техником в Балуне"
176,КОНСУЛЬТАТИВНЫЙ КОЛИЧЕСТВО,"Дотрагивающийся документальный кот и пастор-повар, который должен найти лумберджек в Балуне"
179,КОЛИЧЕСТВО,"Драма безумного учёного и человека, который должен сбежать от пионера в оставленных шахтах"
182,КОНТРОЛЬНАЯ АНТЕМА,"Ужасный документальный фильм о роботе и студенте, который должен сражаться с котом в монастыре"
194,ГРЕЙСКИЙ ХАРАКТЕР,"Внушающий благоговение документальный фильм о женщине и муже, который должен поймать администратора базы данных на первой пилотируемой космической станции"
200,ВЕРТАИННЫЙ ВИДЕОТАП,"Скучное воспоминание о дантисте и безумном кове, который должен искать секретного агента в акульем танке"
203,МЕНЬШИНСТВА,"Быстрая сага пирожного шеф-повара и обезьяны, которые должны выпить композитора в древней Индии"
211,ВРЕМЯ ВРЕМЯ,"Блестящий документальный фильм астронавта и белки, которые должны освежить студента в Мексиканском заливе"
214,Дорогой Мэдиган,"Прекрасная история о охотнике и безумном учёном, который должен встретить белку на первой охотничьей космической станции"
221,УСИЛИЕ МЮЛХОЛЛАНД,"Удивительная Сага обезьяны и мухи, которые должны побеждать дворецкого в акульем танке"
222,МЕРОПРИЯТИЯ ДЕРТА,"Блестящий документальный фильм дворецкого и фрисби, который должен построить астронавт в Новом Орлеане"
225,ДЕСТИНАЦИЯ ИЕРК,"Красивая ярна учителя и кошки, которые должны построить машину в U-Boat"
238,ДОКТОР ГРАЙЛЬ,"Знаменитая драма о женщине и официантке, которая должна связаться с судебно-психиатром в отставке"
253,КОММЕНТАРИИ ДРИФТЕРА,"Эпическое воспоминание о женщине и белке, которая должна открыть мужа в лодке"
266,ДИНАМИТ ТАРСАН,"Бесстрашная документальная грамота судебно-психиатра и сумасшедшего стипендиата, который должен встретиться с исследовательницей в U-Boat"
268,РАННЕЕ ДОРОЖНОЕ ДОМ,"Удивительная панорама безумного учёного и мужа, который должен встретить женщину в отставке"
269,ВОДОТОКОВ ИНСТИТУЦИОНАЛЬНО,"Потрясающий характер исследования дантиста и безумного коровы, который должен найти учителя в Нигерии"
272,Поцелуй EDGE,"Прекрасная ярна композитора и безумной коровы, которая должна вернуть безумного учёного в лодке"
273,ЭФФЕКТИВНЫЙ ГЛАДИКАТОР,"Прекрасная показка пастора-повара и пастора-повара, который должен перестрелять судебно-психиатра в манхэттенском пентхаусе"
274,ЭГГ ИГБ,"Прекрасный документальный фильм о лодке и сумо-рестлере, который должен обработать администратора базы данных на первой пилотируемой космической станции"
282,КОНСУЛЬТАТИВНЫЕ МЕРОПРИЯТИЯ,"Знаменитый волшебник и жених, который должен построить лодку в Новом Орлеане"
288,ЭСКАТО МЕТРОПОЛИС,"Таут-ярн астронавта и технического писателя, который должен перестрелять лодку в Новом Орлеане"
291,ВЫБОРЫ ЗАГРЯЗНЯЮЩИХ ВЕЩЕСТВ,"Фантастическое исследование феминистки и безумца, который должен найти исследователя на фабрике в Балуне"
294,ОЦЕНКА ПРИРОДНЫХ,"Удивительная драма дворецкого и мужа, который должен достать акулу в U-Boat"
304,ФАРГО ГАНДИ,"Удивительное представление о пасторском поваре и крокодиле, который должен дотянуться до учителя в отставке"
306,МЕТАЛЛ,"Разумная ярна обезьяны и учительница, которая должна найти собаку в Австралии"
310,ВСЕОБЪЕМЛЮЩЕЕ,"Разумная панорама кошки и лодки, которые должны повредить лодку в Мексиканском заливе"
314,ДЖАВБЕР,"Вспыльчивая панорама женщины и девушки, которая должна сбежать от девушки в Манхэттенском пентхаусе"
326,Плывающая хука,"Странное представление безумной коровы и собаки, которая должна бросить вызов фрисби в Нигерии"
338,ФРИСКО,"Прекрасный документальный фильм о женщине и пионере, который должен преследовать безумного учёного в акульем танке"
352,ДАЛЬНЕЙШЕЕ РАСПИСАНИЕ,"Неописуемая история о пионере и музе, который должен побороть фрисби на конвенции MySQL"
355,ГОСТУСТЫ ЭТО,"Разумный порыв собаки и феминистки, которые должны отследить композитора в Берлине"
361,СВЯЗАННЫЙ ДЖАВБРЕКЕР,"Удивительное представление композитора и судебно-психиатра, который должен открыть автомобиль в канадских скалах"
368,Тяжело.,"Знающий характер исследования безумной коровы и судебно-психиатра, который должен победить акулу в Манхэттенском пентхаусе"
369,ГОДФЕЛЛЫ СОЛУТЫ,"Неверная история о собаке и Исследователе, который должен поглотить безумную корову на фабрике в Балуне"
370,ГОРОДСКИЕ БИНПО,"Демонстрация сумо-рестлера и машины, которая должна превзойти официантку на фабрике в Балуне"
375,ГРАЙЛЬ ФРАНкеНСТЕЙН,"Неверная сага учителя и обезьяны, которые должны сражаться с девушкой в оставленных шахтах"
378,ДЕВЯТЫЙ НОРТ,"Поразительное исследование о секретном агенте и роботе, который должен построить акулу в Берлине"
381,МЕСТО ПРОВЕДЕНИЯ,"Бесстрашная демонстрация безумца и феминистки, которые должны преследовать пионера на первой пилотируемой космической станции"
383,ПОРЯДОК ПРОВЕДЕНИЯ ПРЕКРАЩЕНИЯ,"Неверное воспоминание о музе и акуле, который должен подавить лумберджека в заброшенном шахтном шафте"
384,ГРОСКИЙ ЗАДОЛЖЕННЫЙ,"Эпическая драма кошки и Исследователя, который должен вернуть музея в Австралии"
397,ОКТЯБРЬ ХАНКИ,"Скучное представление об администраторе базы данных и Исследователе, который должен преследовать безумца в Советской Грузии"
404,Ненавижу Хандикап,"Беспокойное воспоминание о безумном учёном и пионере, который должен преодолеть охотника на первой пилотируемой космической станции"
407,HAWK HILLL,"Драма безумного учёного и композитора, который должен перестрелять автомобиль в Австралии"
412,ТЯЖЕЛЫЕ ВЕЩЕСТВА,"Неверная история композитора и собаки, которая должна преодолеть женщину в заброшенном парке развлечений"
415,ВЫСОКОЕ ЭНКИНО,"Ужасная Сага официантки и охотника, который должен выйти из сумо-рестлера в Австралии"
416,ВЫСШИЙ ПОТЕР,"Собранная сага мужа и собаки, которая должна вернуть администратора базы данных в пустыне Сахара"
419,ГОСУС ФРИДА,"Внушающая благоговение история о девушке и безумце, который должен перестрелять студента в акульем танке"
420,ГОЛОС БРАННИГАН,"Быстрое отражение технического писателя и студента, который должен сражаться с мальчиком в канадских скалах"
431,ХОЗЯЙСТВА,"Поразительное отображение исследовательницы и лодки, которая должна погубить автомобиль на первой пилотируемой космической станции"
433,РАБОТА,"Потрясающее представление о безумном учёном и техническом писателе, который должен сложить обезьяну в акульем танке"
437,ДИНАМИТ Дома,"История первопроходца и белки, которая должна сразиться со студентом в Советской Грузии"
460,НЕЗАВИСИМЫЙ УСТРОЙСТВЕННЫЙ,"Прекрасная драма пионера и крокодила, который должен бросить вызов ученику в отставке"
496,ЦЫПЛЕНОК САВАННА,"Эмоциональная драма обезьяны и робота, который должен уничтожить обезьяну в Новом Орлеане"
501,Поцелуи,"Разумное мышление пионера и учителя, который должен построить композитора на первой пилотируемой космической станции"
502,КОЛИЧИЙ ВАРЛОК,"Неверная история учителя и лодки, которые должны сразиться с мусой в Балуне"
505,ЛАЙРЕНТНАЯ ЛЕГЬ,"Внушающая благоговение сага композитора и фрисби, который должен посадить пионера в пустыне Сахара"
506,Леди Стой.,"Прекрасный характер исследования женщины и человека, который должен искать исследователь в U-Boat"
513,ЛИДЕРНЕКИ ДУАФЫ,"Ужасное воспоминание о собаке и безумной корове, которая должна отвлечь учителя в оставленных шахтах"
519,МАГЕНТ СВОБОДЫ,"Скучная драма студента и кошки, которые должны поймать технического писателя в Балуне"
535,ЛЮБОВЫЕ УЧРЕЖДЕНИЯ,"Блестящая панорама охотника и исследователя, который должен преследовать дантиста в заброшенном доме веселья"
544,МАДИСОННАЯ ТРУБКА,"Тревожное воспоминание о обезьяне и дантистах, которые должны превзойти пионера в U-Boat"
546,МАДРЕВЫЕ ГАБЛИЦЫ,"Вспыльчивая панорама сумо-рестлера и судебно-психиатра, который должен открыть мус на первой орбитальной станции"
547,МАГИЧЕСКИЕ МАЛРАТЫ,"Дотрагивающийся документальный пасторский шеф-повар и пастор-повар, который должен построить безумного стипендиата в Калифорнии"
548,ВЕЩЕСТВЕННАЯ ЧИТТА,"Знающая история учителя и охотника, который должен встретиться с безумной коровой в Калифорнии"
570,"МЕРОПРИЯТИЯ, СВЯЗАННЫЕ С МЕНЬШИНСТВАМИ","Драма неудачницы официантки и мужа, который должен сражаться с мужем в Калифорнии"
571,МЕТАЛЛОВЫЙ АРМАГЕДОН,"Ужасное представление о люмберджеке и крокодиле, который должен встретить обезьяну на фабрике в Балуне"
572,МЕТРОПОЛИЧЕСКАЯ КОМА,"Эмоциональная сага администратора базы данных и шеф-повара, который должен противостоять учителю на фабрике в Балуне"
575,МИДСУММЕРСКИЙ ГРУЗ,"Ужасная панорама мухи и собаки, которая должна отследить крокодил в Древней Японии"
580,Мои титаны,"Удивительная ярна робота и Женщина, которая должна открыть в Берлине судебно-психиатра"
581,Поцелуи МЕНЬШИНСТВ,"Знаменитый показ мухоловки и сумо-рестлера, который должен встретить человека в отставке"
589,МЕЖПРАВИТЕЛЬСТВЕННАЯ ДОРАДО,"Историю дворецкого и сумо-рестлера, который должен спасти мальчика в Новом Орлеане"
599,Мать СВЯЗИ,"Скучная история о муже и мальчике, который должен сражаться с белкой в древнем Китае"
608,ЧРЕЗВЫЧАЙНЫЙ АНТИТРАСТ,"Блестящая ярна автомобиля и администратор базы данных, который должен сбежать от мальчика в конвенции MySQL"
615,НАШ ЧОКОЛАТ,"Эпическое воспоминание о обезьяне и безумной корове, которая должна убить судебно-психиатра в заброшенном шахтном шафте"
622,ИСТОРИЯ НОВЫХ СООБЩЕНИЙ,"Исследовать сложенный образ собаки и люмберджека, который должен выйти из мухи в Мексиканском заливе"
634,ОДДС БУГИ,"Ужасная ярна феминистки и безумца, который должен сразиться с охотником в Берлине"
640,ICE OPUS,"Быстрая драма охотника и мальчика, который должен открыть феминистку в пустыне Сахара"
642,ПОРЯДОК ПРОВЕДЕНИЯ,"Удивительная сага собаки и акулы, которые должны бросить вызов кошке в пустыне Сахара"
645,ЧАСТЬ ТРЕТЬЯ,"Документальный документ о безумной корове и безумце, который должен поглотить мус в Мексиканском заливе"
646,ДВИЖЕНИЕ ВЫБРОСОВ,"Неверный ярн администратора базы данных и женщина, которая должна окунуть акулу в U-Boat"
647,ВНЕШНИЙ МАССАКРЕ,"Разумная драма мужа и секретного агента, который должен искать администратора базы данных в древней Индии"
653,ПАНСКИЙ КЛУБ,"Фантастическое представление учителя и крокодила, который должен одеть девушку в балуне"
657,ПАРАДИС САБРИНА,"Вспыльчивая ярна машины и муся, который должен выйти из крокодила в Манхэттенском пентхаусе"
659,ПАРК СИТИЗЕН,"Тяжелое зрелище сумо-рестлера и девушки, которая должна встретиться с мужем в Древней Японии"
660,ВСТУПИТЕЛЬНЫЙ КОЛИЧЕСТВО,"Ужасное представление технического писателя и дворецкого, который должен сражаться с сумо-рестлером в заброшенном шахтном шафте"
676,ЖЕНЩИНА ФИЛАДЕЛЬФИИ,"Таут Ярн охотника и астронавта, который должен завоевать администратора базы данных в пустыне Сахара"
677,ПЕРСОНАЛ ФИАНИСТА,"Неописуемая история мальчика и технического писателя, который должен идти за люмберджеком в монастыре"
679,ПОЛИТИЧЕСКИЕ ХОЗЯЙСТВА,"Тревожное воспоминание о крокодиле и сумо-рестлере, который должен встретиться с судебно-медицинским психологом в заброшенном шахтном шафте"
683,МЯСО МЯСА,"Скучная панорама феминистки и музея, которая должна уничтожить администратора базы данных в Нигерии"
684,ПИЗЗА ЮМАНДЖИ,"Эпическая сага кошки и белка, которая должна перестрелять робота в U-Boat"
