film_id,title,description
25,АНГЕЛЬСКАЯ ЖИЗНЬ,"Разумное представление женщины и астронавта, которая должна сразиться с роботом в Берлине"
37,АРИЗОНА БАНГ,"Блестящая панорама безумного учёного и безумного коровы, которая должна встретить пионера в монастыре"
39,АМАГЕДОННАЯ ЗАДЕРЖКА,"Быстрая история о лодке и учителе, который должен освежить композитора в оставленных шахтах"
53,БАН КВАЙ,"Эпическая драма безумца и кошки, которая должна встретиться с акулой в заброшенном парке развлечений"
92,БОЛЕЕ СВЯЗИ,"Быстрый ярн официантки и композитор, который должен перестрелять дантиста в Калифорнии"
103,"Чёрт возьми, бродяга.","Удивительное зрелище девушки и жениха, которые должны освежить ламберджек на фабрике в Балуне"
128,КАТХ МАССАД,"Скучное воспоминание о Ламберджеке и феминистке, который должен открыть женщину в Нигерии"
135,НАБЛЮДЕНИЕ ЗА ПЫТОМ,"Поразительная история судебно-психиатра и судебно-психиатра, который должен преодолеть мус в Древнем Китае"
149,КРИСТМАССКИЙ МОНШИН,"Сложенная в действие Эпизод феминистского и астронавта, который должен завоевать лодку в Манхэттенском пентхаусе"
155,КЛЕОПАТРА ДЕВИЛЬ,"Фантастический документальный фильм о крокодиле и техническом писателе, который должен сражаться с акулой в балуне"
162,УСТРОЙСТВА ДЛЯ ЗАГРЯЗНЯЮЩИХ ВЕЩЕСТВ,"Табличка о машине и пионере, который должен побороть сумо-рестлер в заброшенном доме веселья"
170,Комманд ДАРЛИНГ,"Внушающая благоговение история о судебно-психиатре и женщине, которая должна бросить вызов администратору базы данных в Древней Японии"
199,СИННИРОВАНИЕ КУЗОВОВ,"Эмоциональное воспоминание о фрисби и лодке, которая должна дотянуться до пасторского шеф-повара в заброшенном парке развлечений"
222,МЕРОПРИЯТИЯ ДЕРТА,"Блестящий документальный фильм дворецкого и фрисби, который должен построить астронавт в Новом Орлеане"
226,ДЕТИНСКАЯ СУББОТА,"Прикасающаяся драма крокодила и крокодила, который должен побороть исследователь в Советской Грузии"
250,ДРАГОНСКИЙ КВАД,"Великолепное воспоминание о мальчике и официантке, которая должна перестрелять учителя в Древнем Китае"
269,ВОДОТОКОВ ИНСТИТУЦИОНАЛЬНО,"Потрясающий характер исследования дантиста и безумного коровы, который должен найти учителя в Нигерии"
282,КОНСУЛЬТАТИВНЫЕ МЕРОПРИЯТИЯ,"Знаменитый волшебник и жених, который должен построить лодку в Новом Орлеане"
312,УБЕЖАЩАЯСЯ В СВЯЗИ С ФИЗИЧЕСКИМИ РЕСУРСАМИ,"Скучная история о белке и собаке, которая должна бросить вызов безумцу в Мексиканском заливе"
321,FLASH WARS,"Потрясающая Сага муз и пастор-повар, который должен отследить студента в Мексиканском заливе"
322,УБИЙСТВА УБИЙСТВА,"Выставка секретного агента и официантки, которая должна поглотить робота в заброшенном шахтном шафте"
323,МЯСО СВЕТА,"Потрясающий характер изучения крокодила и пионера, который должен преследовать учителя в Новом Орлеане"
326,Плывающая хука,"Странное представление безумной коровы и собаки, которая должна бросить вызов фрисби в Нигерии"
336,ФРАНЦИЯ ХОЛИДЕЙ,"Ужасный порыв собаки и феминистки, которые должны убить безумца в Берлине"
407,HAWK HILLL,"Драма безумного учёного и композитора, который должен перестрелять автомобиль в Австралии"
422,ДОЛЖНЯЯ ЖЕОПАРДИЯ,"Прекрасный характер исследования робота и астронавта, который должен преодолеть лодку в монастыре"
424,ГОЛОКАУСТЫЙ ВЫСШИЙ БАЛЛ,"Ярн композитора и человека, который должен найти робота в Советской Грузии"
450,IDOLS NATERS,"Разумная драма машины и композитора, которые должны сражаться с человеком в монастыре"
460,НЕЗАВИСИМЫЙ УСТРОЙСТВЕННЫЙ,"Прекрасная драма пионера и крокодила, который должен бросить вызов ученику в отставке"
475,ЯПОНИЯ,"Внушает благоговейное восхищение феминисткой и девушкой, которая должна поглотить девушку в отставке"
494,КАРАТА МУН,"Удивительная ярна женщины и собаки, которая должна дотянуться до официантки в конвенции MySQL"
495,КЕНТУКСКИЙ ДЖАНТ,"Потрясающая ярна женщины и фрисби, которая должна сбежать с официанткой в U-Boat"
536,Любимый джингл,"Фантастическая ярна крокодила и криминалист-психолог, который должен открыть крокодил в отставке"
539,УСТАНОВКА,"Скучное представление о музе и белке, которая должна выгнать учителя в акульем танке"
544,МАДИСОННАЯ ТРУБКА,"Тревожное воспоминание о обезьяне и дантистах, которые должны превзойти пионера в U-Boat"
568,МЕМЕНТО ЗОЛАНДЕР,"Прикоснувшись к белке и исследователь, который должен вернуть повара-пастуха в пустыне Сахара"
610,Музыка,"Потрясающая история о дворецком и астронавте, который должен сражаться с исследовательницей на первой пилотируемой космической станции"
614,НАЗНАЧЕНИЕ ДЕТЕКТИВНОГО,"Прикасающаяся Сага сумо Рестлера и кошка, которая должна преследовать безумного учёного в Нигерии"
641,ГРАФЫ ОРАНА,"Поразительный документальный фильм о дворецком и женоненавистнике, который должен встретиться с собакой в U-Boat"
649,ОЗ ЛИАИЗОНЫ,"Эпиковый ярн безумного учёного и кота, который должен встретить женщину на фабрике в Балуне"
672,ПЕРСПЕКТИВНЫЙ ГРООВ,"Ужасная ярна собаки и собаки, которая должна построить мужа в балуне"
674,ПИТАНИЕ НА МЕСТАХ,"Неверное представление о Исследователе и лодке, которая должна победить женщину в Калифорнии"
687,POCUS PULP,"Вспыльчивая ярна фрисби и собака, которая должна построить астронавт на фабрике в Балуне"
709,EGG RAСЕР,"Эмоциональная демонстрация обезьяны и официантки, которая должна связаться с секретным агентом в Калифорнии"
711,РАЖИРОВАНИЕ АРПЛАНА,"Удивительная демонстрация секретного агента и технического писателя, который должен сбежать от безумного учёного в джетовом лодке"
727,СИЛВЕРАДО НАБЛЮДЕНИЯ,"Epic Yarn of a Robot and Explorer, который должен бросить вызов девушке в конвенции MySQL"
752,РУННЕР МАДИГАН,"Разумный документальный фильм о крокодиле и роботе, который должен выгнать женщину в отъезде"
758,САНКЦИИ,"Удовлетворительная история технического писателя и композитора, который должен искать исследователя в Мексиканском заливе"
769,ШКОЛНАЯ ПОЯСНИТЕЛЬНАЯ СТРУКТУРА,"Неспокойный ярн обезьяны и мальчика, который должен сражаться с композитором в Манхэттенском пентхаусе"
796,СЬЕРРА ДИВИДЕ,"Эмоциональный характер исследования фрисби и безумного учёного, который должен построить безумца в Калифорнии"
799,МИНИМАЛЬНЫЙ НОРГЕТИЧЕСКИЙ,"Увлекательный документатор технического писателя и акулы, который должен встретиться с пионером в акульем танке"
825,СРОКИ СВЯЗИ С ДАННЫМИ,"Драма неудачной работы судебно-психиатра и машины, которая должна вернуть человека в Манхэттенский пентхаус"
845,СВЯЗЬ С ТЕМПОМОМ,"Прикоснувшись к крокодилу и учителю, который должен построить судебно-медицинского психолога в Конвенции MySQL"
852,СТРАЖЕННАЯ СЕССИЯ,"Побуждающая панорама Ламберджека и официантка, которая должна уничтожить крокодил в заброшенном парке развлечений"
864,ВНЕСЕНИЕ ВЗНОСА,"Эпическая драма охотника и исследователь, который должен противостоять охотнику на фабрике в Балуне"
882,КОММАНДАЦИЯ ТЕНЕНБАУМОВ,"Показ первопроходца и человека, который должен достать девушку в Мексиканском заливе"
903,ДОРОЖНЫЙ ДВИЖЕНИЕ,"Удивительное зрелище белки и люмберджека, который должен упаковать администратора базы данных в U-Boat"
905,ТРУДЯЩИЕСЯ УСТРОЙСТВА,"Быстрая драма пионера и безумного коровы, которая должна бросить вызов безумцу в Древней Японии"
911,ТРИП НЬЮТОН,"Фантастическое исследование стиля и автомобиля, который должен открыть кошку в заброшенном парке развлечений"
931,VALentin Vanisming,"Увлекательное представление мужа и дворецкого, который должен дотянуться до повара-пастуша в Калифорнии"
939,ВЕРТИГО НОРТВЕСТИЯ,"Неверный показ безумного и безумного стипендиата, который должен перестрелять безумную корову в древней Японии"
961,ТЯЖЕЛАЯ ВЕЩЕСТВА ДЛЯ ВОССТАНОВЛЕНИЯ,"Тревожное воспоминание о кошке и пионере, который должен сбежать с охотником в древнем Китае"
977,СИДА ВИНДОУ,"Удивительное изучение охотника за женщиной и охотника, который должен сбежать с робота в монастыре"
980,ВИЗАРА КОЛБРЛУД РУКОВОДЯЩИЙ СТРУКТУР,"Недостаток в представлении робота и девушки, которая должна подавить сумо-рестлера на конвенции MySQL"
989,РАБОЧИЕ МИКРОКОСМОСЫ,"Потрясающий порыв дантиста и собаки, которые должны убить безумца в Древнем Китае"
