film_id,title,description
6,AGENT TRUMAN,A Intrepid Panorama of a Robot And a Boy who must Escape a Sumo Wrestler in Ancient China
8,AIRPORT POLLOCK,A Epic Tale of a Moose And a Girl who must Confront a Monkey in Ancient India
21,AMERICAN CIRCUS,A Insightful Drama of a Girl And a Astronaut who must Face a Database Administrator in A Shark Tank
27,ANONYMOUS HUMAN,A Amazing Reflection of a Database Administrator And a Astronaut who must Outrace a Database Administrator in A Shark Tank
38,ARK RIDGEMONT,A Beautiful Yarn of a Pioneer And a Monkey who must Pursue a Explorer in The Sahara Desert
52,BALLROOM MOCKINGBIRD,A Thrilling Documentary of a Composer And a Monkey who must Find a Feminist in California
70,BIKINI BORROWERS,A Astounding Drama of a Astronaut And a Cat who must Discover a Woman in The First Manned Space Station
94,BRAVEHEART HUMAN,A Insightful Story of a Dog And a Pastry Chef who must Battle a Girl in Berlin
99,BRINGING HYSTERICAL,A Fateful Saga of a A Shark And a Technical Writer who must Find a Woman in A Jet Boat
108,BUTCH PANTHER,A Lacklusture Yarn of a Feminist And a Database Administrator who must Face a Hunter in New Orleans
116,CANDIDATE PERDITION,A Brilliant Epistle of a Composer And a Database Administrator who must Vanquish a Mad Scientist in The First Manned Space Station
123,CASABLANCA SUPER,A Amazing Panorama of a Crocodile And a Forensic Psychologist who must Pursue a Secret Agent in The First Manned Space Station
146,CHITTY LOCK,A Boring Epistle of a Boat And a Database Administrator who must Kill a Sumo Wrestler in The First Manned Space Station
150,CIDER DESIRE,A Stunning Character Study of a Composer And a Mad Cow who must Succumb a Cat in Soviet Georgia
164,COAST RAINBOW,A Astounding Documentary of a Mad Cow And a Pioneer who must Challenge a Butler in The Sahara Desert
190,CREEPERS KANE,A Awe-Inspiring Reflection of a Squirrel And a Boat who must Outrace a Car in A Jet Boat
194,CROW GREASE,A Awe-Inspiring Documentary of a Woman And a Husband who must Sink a Database Administrator in The First Manned Space Station
243,DOORS PRESIDENT,A Awe-Inspiring Display of a Squirrel And a Woman who must Overcome a Boy in The Gulf of Mexico
258,DRUMS DYNAMITE,A Epic Display of a Crocodile And a Crocodile who must Confront a Dog in An Abandoned Amusement Park
270,EARTH VISION,A Stunning Drama of a Butler And a Madman who must Outrace a Womanizer in Ancient India
282,ENCOUNTERS CURTAIN,A Insightful Epistle of a Pastry Chef And a Womanizer who must Build a Boat in New Orleans
293,EXORCIST STING,A Touching Drama of a Dog And a Sumo Wrestler who must Conquer a Mad Scientist in Berlin
298,EYES DRIVING,A Thrilling Story of a Cat And a Waitress who must Fight a Explorer in The Outback
302,FANTASIA PARK,A Thoughtful Documentary of a Mad Scientist And a A Shark who must Outrace a Feminist in Australia
313,FIDELITY DEVIL,A Awe-Inspiring Drama of a Technical Writer And a Composer who must Reach a Pastry Chef in A U-Boat
377,GREASE YOUTH,A Emotional Panorama of a Secret Agent And a Waitress who must Escape a Composer in Soviet Georgia
413,HEDWIG ALTER,A Action-Packed Yarn of a Womanizer And a Lumberjack who must Chase a Sumo Wrestler in A Monastery
427,HOMEWARD CIDER,A Taut Reflection of a Astronaut And a Squirrel who must Fight a Squirrel in A Manhattan Penthouse
467,INTRIGUE WORST,A Fanciful Character Study of a Explorer And a Mad Scientist who must Vanquish a Squirrel in A Jet Boat
486,JET NEIGHBORS,A Amazing Display of a Lumberjack And a Teacher who must Outrace a Woman in A U-Boat
535,LOVE SUICIDES,A Brilliant Panorama of a Hunter And a Explorer who must Pursue a Dentist in An Abandoned Fun House
542,LUST LOCK,A Fanciful Panorama of a Hunter And a Dentist who must Meet a Secret Agent in The Sahara Desert
549,MAGNOLIA FORRESTER,A Thoughtful Documentary of a Composer And a Explorer who must Conquer a Dentist in New Orleans
556,MALTESE HOPE,A Fast-Paced Documentary of a Crocodile And a Sumo Wrestler who must Conquer a Explorer in California
566,MAUDE MOD,A Beautiful Documentary of a Forensic Psychologist And a Cat who must Reach a Astronaut in Nigeria
581,MINORITY KISS,A Insightful Display of a Lumberjack And a Sumo Wrestler who must Meet a Man in The Outback
597,MOONWALKER FOOL,A Epic Drama of a Feminist And a Pioneer who must Sink a Composer in New Orleans
610,MUSIC BOONDOCK,A Thrilling Tale of a Butler And a Astronaut who must Battle a Explorer in The First Manned Space Station
611,MUSKETEERS WAIT,A Touching Yarn of a Student And a Moose who must Fight a Mad Cow in Australia
612,MUSSOLINI SPOILERS,A Thrilling Display of a Boat And a Monkey who must Meet a Composer in Ancient China
671,PERDITION FARGO,A Fast-Paced Story of a Car And a Cat who must Outgun a Hunter in Berlin
682,PITTSBURGH HUNCHBACK,A Thrilling Epistle of a Boy And a Boat who must Find a Student in Soviet Georgia
685,PLATOON INSTINCT,A Thrilling Panorama of a Man And a Woman who must Reach a Woman in Australia
702,PULP BEVERLY,A Unbelieveable Display of a Dog And a Crocodile who must Outrace a Man in Nigeria
735,ROBBERS JOON,A Thoughtful Story of a Mad Scientist And a Waitress who must Confront a Forensic Psychologist in Soviet Georgia
736,ROBBERY BRIGHT,A Taut Reflection of a Robot And a Squirrel who must Fight a Boat in Ancient Japan
737,ROCK INSTINCT,A Astounding Character Study of a Robot And a Moose who must Overcome a Astronaut in Ancient India
747,ROXANNE REBEL,A Astounding Story of a Pastry Chef And a Database Administrator who must Fight a Man in The Outback
749,RULES HUMAN,A Beautiful Epistle of a Astronaut And a Student who must Confront a Monkey in An Abandoned Fun House
760,SAMURAI LION,A Fast-Paced Story of a Pioneer And a Astronaut who must Reach a Boat in A Baloon
773,SEABISCUIT PUNK,A Insightful Saga of a Man And a Forensic Psychologist who must Discover a Mad Cow in A MySQL Convention
791,SHOW LORD,A Fanciful Saga of a Student And a Girl who must Find a Butler in Ancient Japan
802,SKY MIRACLE,A Epic Drama of a Mad Scientist And a Explorer who must Succumb a Waitress in An Abandoned Fun House
803,SLACKER LIAISONS,A Fast-Paced Tale of a A Shark And a Student who must Meet a Crocodile in Ancient China
812,SMOKING BARBARELLA,A Lacklusture Saga of a Mad Cow And a Mad Scientist who must Sink a Cat in A MySQL Convention
817,SOLDIERS EVOLUTION,A Lacklusture Panorama of a A Shark And a Pioneer who must Confront a Student in The First Manned Space Station
846,STING PERSONAL,A Fanciful Drama of a Frisbee And a Dog who must Fight a Madman in A Jet Boat
847,STOCK GLASS,A Boring Epistle of a Crocodile And a Lumberjack who must Outgun a Moose in Ancient China
885,TEXAS WATCH,A Awe-Inspiring Yarn of a Student And a Teacher who must Fight a Teacher in An Abandoned Amusement Park
891,TIMBERLAND SKY,A Boring Display of a Man And a Dog who must Redeem a Girl in A U-Boat
926,UNTOUCHABLES SUNRISE,A Amazing Documentary of a Woman And a Astronaut who must Outrace a Teacher in An Abandoned Fun House
943,VILLAIN DESPERATE,A Boring Yarn of a Pioneer And a Feminist who must Redeem a Cat in An Abandoned Amusement Park
944,VIRGIN DAISY,A Awe-Inspiring Documentary of a Robot And a Mad Scientist who must Reach a Database Administrator in A Shark Tank
975,WILLOW TRACY,A Brilliant Panorama of a Boat And a Astronaut who must Challenge a Teacher in A Manhattan Penthouse
